3600847,20151214182722.0,ss|lmnjluz|nuu,991101s1985 nyunnn l eng d,(NIC)notisASF7912;3600847;(OCoLC)63896710;,NIC,NIC,NIC ;NIC;,,"Stockwell, John,",,1937- ,,,,Secret wars of the CIA,,[sound recording],1985.,2 sound cassettes (150 min.) :,"analog, mono.","Recorded in Ithaca, NY by Cornell University.;Accompanied by: Notes.;Sponsored by: Student Finance Commission,Committee on United
                States-Latin American Relations (CUSLAR).;",,,,,"Panel, October 2, 1985.","Panel discusses several aspects of the CIA: recruitment on campus,
                international law and involvement in Central America, an ""inside"" view of
                the organization, and current CIA operations in Nicaragua.",No reproductions authorized.,,,,,,,,,,,,,,,,,,United States.,Central Intelligence Agency.,(OCoLC)fst00536259,fast,United States.,Central Intelligence Agency,Cornell University,Recruiting.,,(OCoLC)fst00530369,fast,Cornell University,,,,,,,,,,Intelligence service.;International relations.;,,,,,(OCoLC)fst01907412;(OCoLC)fst00975848;(OCoLC)fst00977053;,fast;fast;fast;,Diplomatic relations;Intelligence service;International relations;,,United States,Foreign relations,,Central America.,(OCoLC)fst01244535;(OCoLC)fst01204155;,fast;fast;,Central America;United States;,,,,,"MacMichael, David C.;Kenworthy, Eldon G.;Hathaway, Dale.;",,,,,,,,,CULectures,20000327120000.0,20141221,m,batch,lts,addfast,01914cim a22004572u 4500
3600787,20151214182712.0,ss|lmnjluz|nuu,991101s1985 nyunnn l eng d,(NIC)notisASF7852;3600787;(OCoLC)63896602;,NIC,NIC,NIC ;NIC;,,"Shevchenko, Arkady N.",,,,,,Breaking with Moscow: revelations of a Soviet diplomat,,[sound recording],1985.,1 sound cassette (55 min.) :,"analog, mono.","Recorded in Ithaca, NY by Cornell University.;Sponsored by: Center for International Studies.;Speaker(s): Soviet defector and former Soviet diplomat.;",,,,,"Lecture, October 24, 1985.","Shevchenko describes his own experiences as a Soviet diplomat and as
                a defector from the Soviet Union and discusses US-USSR relations.",,,,,,,,,,,,,,,,,,,,,,,,,,,,,,,,,,,,,,,,Political refugees;Defectors.;,,,,Soviet Union.,(OCoLC)fst00889593;(OCoLC)fst01907412;(OCoLC)fst01069678;,fast;fast;fast;,Defectors;Diplomatic relations;Political refugees;,,United States;Soviet Union;,Foreign relations;Foreign relations;,,Soviet Union.;United States.;,(OCoLC)fst01210281;(OCoLC)fst01204155;,fast;fast;,Soviet Union;United States;,,,,,,,,,,,,,,CULectures,20000323120000.0,20141221,m,batch,lts,addfast,01484cim a22003732u 4500
3600299,20151214182538.0,ss|lmnjluz|nuu,991101s1985 nyunnn l eng d,(NIC)notisASF7364;3600299;(OCoLC)63895845;,NIC,NIC,NIC;NIC;,,"Schwaetzer, Irmgard,",,1942-,,,,West German parties and their politics,,[sound recording],1985.,1 sound cassette (60 min.) :,"analog, mono.","Recorded in Ithaca, NY by Cornell University.;Accompanied by: Notes.;Sponsored by: Western Societies Program.;Speaker(s): Member of the Free Democratic Party.;",,,,,"Lecture, October 30, 1985.","Adan-Schaetzer discusses West German political parties and social
                political conditions in West Germany.",,,,,,,,,,,,,,,,,,,,,,,,,,,,,,,,,,,,,,,,,,,,,(OCoLC)fst01069781,fast,Political science,,Germany (West),Politics and government.,,,(OCoLC)fst01210273,fast,Germany (West),,,,,,,,,,,,,,CULectures,20000403120000.0,20141221,m,batch,lts,addfast,01149cim a22003132u 4500
3600800,20151214182714.0,ss|lmnjluz|nuu,991101s1985 nyunnn l eng d,(NIC)notisASF7865;3600800;(OCoLC)63896624;,NIC,NIC,NIC,,"Soyinka, Wole.",,,,,,"Outward glance and inward retreat: ambivalence in African arts and
                literature",,[sound recording],1985.,1 sound cassette (75 min.) :,"analog, mono.","Recorded in Ithaca, NY by Cornell University.;Sponsored by: Society for the Humanities.;",,,,,"Lecture, November 11, 1985.","Soyinka provides a detailed analysis of African art and discusses
                Western attitudes toward it.",,,,,,,,,,,,,,,,,,,,,,,,,,,,,,,,,,,,,,,,"African literature.;Art, African.;",,,,,(OCoLC)fst00799832;(OCoLC)fst00815861;,fast;fast;,"African literature;Art, African;",,,,,,,,,,,,,,,,,,,,,,CULectures,19991201120000.0,20141221,m,batch,lts,addfast,01068cim a22003012u 4500
3600716,20151214182658.0,ss|lmnjluz|nuu,991101s1986 nyunnn l eng d,(NIC)notisASF7781;3600716;(OCoLC)63896492;,NIC,NIC,NIC;NIC;,,"Said, Edward W. ",,,,,,"Culture and imperialism: overlapping territories, intertwined
                histories",,[sound recording],1986.,1 sound cassette (85 min.) :,"analog, mono.","Recorded in Ithaca, NY by Cornell University.;Accompanied by: Notes.;",,,,,"Lecture, February 6, 1986.","Said examines the intertwined relationship between history, culture,
                and imperialism.",No reproductions authorized.,,,,,,,,,,,,,,,,,,,,,,,,,,,,,,,,,,,,,,,Culture.;Imperialism.;,,,,,(OCoLC)fst00885059;(OCoLC)fst00968126;,fast;fast;,Culture;Imperialism;,,,,,,,,,,,,,,,,,,,,Culture and imperialism.;Messenger lectures.;,,CULectures,20000320120000.0,20141221,m,batch,lts,addfast,01137cim a22003372u 4500
3600511,20151214182614.0,ss|lmnjluz|nuu,991101s1986 nyunnn l eng d,(NIC)notisASF7576;3600511;(OCoLC)63896167;,NIC,NIC,NIC;NIC;,,"Said, Edward W.",,,,,,Culture and imperialism: consolidated vision,,[sound recording],1986.,1 sound cassette (90 min.) :,"analog, mono.","Recorded in Ithaca, NY by Cornell University.",,,,,"Lecture, February 7, 1986.","Said describes the ""imperialist vision"" as it is manifested
                in culture, especialy in literature.",No reproductions authorized.,,,,,,,,,,,,,,,,,,,,,,,,,,,,,,,,,,,,,,,Culture.;Imperialism.;British literature.;,,,,,(OCoLC)fst00839082;(OCoLC)fst00885059;(OCoLC)fst00968126;,fast;fast;fast;,British literature;Culture;Imperialism;,,,,,,,,,,,,,,,,,,,,Culture and imperialism.;Messenger lectures.;,,CULectures,20000320120000.0,20141221,m,batch,lts,addfast,01178cim a22003492u 4500
3600510,20151214182614.0,ss|lmnjluz|nuu,991101s1986 nyunnn l eng d,(NIC)notisASF7575;3600510;(OCoLC)63896166;,NIC,NIC,NIC;NIC;,,"Said, Edward W. ",,,,,,Culture and imperialism: opposition and resistance,,[sound recording],1986.,1 sound cassette (60 min.) :,"analog, mono.","Recorded in Ithaca, NY by Cornell University.",,,,,"Lecture, February 10, 1986.","Said describes the political and cultural subjugation of non-Western
                culture and explains changes in the nature of imperialism.",No reproductions authorized.,,,,,,,,,,,,,,,,,,,,,,,,,,,,,,,,,,,,,,,Culture.;Imperialism.;British literature.;,,,,,(OCoLC)fst00839082;(OCoLC)fst00885059;(OCoLC)fst01907412;(OCoLC)fst00968126;,fast;fast;fast;fast;,British literature;Culture;Diplomatic relations;Imperialism;,,Great Britain,Foreign relations.,,,(OCoLC)fst01204623,fast,Great Britain,,,,,,,,,,,,Culture and imperialism.;Messenger lectures.;,,CULectures,20000320120000.0,20141221,m,batch,lts,addfast,01386cim a22003852u 4500
3600509,20151214182614.0,ss|lmnjluz|nuu,991101s1986 nyunnn l eng d,(NIC)notisASF7574;3600509;(OCoLC)63896164;,NIC,NIC,NIC;NIC;,,"Said, Edward W. ",,,,,,"Culture and imperialism: domination, future-style",,[sound recording],1986.,1 sound cassette (85 min.) :,"analog, mono.","Recorded in Ithaca, NY by Cornell University.",,,,,"Lecture, February 11, 1986.","Said explains the history, current perspective, and impact of
                colonialism and imperialism.",No reproductions authorized.,,,,,,,,,,,,,,,,,,,,,,,,,,,,,,,,,,,,,,,Imperialism.;World politics.;,,,,,(OCoLC)fst01907412;(OCoLC)fst00968126;(OCoLC)fst01181381;,fast;fast;fast;,Diplomatic relations;Imperialism;World politics;,,Great Britain,Foreign relations.,,,(OCoLC)fst01204623,fast,Great Britain,,,,,,,,,,,,Culture and imperialism.;Messenger lectures.;,,CULectures,20000320120000.0,20141221,m,batch,lts,addfast,01265cim a22003612u 4500
3600516,20151214182615.0,ss|lmnjluz|nuu,991101s1986 nyunnn l eng d,(NIC)notisASF7581;3600516;(OCoLC)63896174;,NIC,NIC,NIC;NIC;NIC;,,"Vlastos, Gregory.",,,,,,Socratic irony,,[sound recording],1986.,1 sound cassette (60 min.) :,"analog, mono.","Recorded in Ithaca, NY by Cornell University.;Accompanied by: Notes.;Sponsored by: Classics, Department of.;",,,,,"Lecture, February 28, 1986.","Vlastos discusses and defines common uses of irony by referring to
                the classical works of Aristotle and Socrates.",No reproductions authorized.,Socrates.;Aristotle.;,,,(OCoLC)fst00029885;(OCoLC)fst00035600;,fast;fast;,Aristotle;Socrates;,,,,,,,,,,,,,,,,,,,,,,,,,,,,,,,,,Irony.;Irony in literature.;,,,,,(OCoLC)fst00979386;(OCoLC)fst00979394;,fast;fast;,Irony;Irony in literature;,,,,,,,,,,,,,,,,,,,,Cornell studies in classical philology.,Townsend lectures.,CULectures,20000313120000.0,20141221,m,batch,lts,addfast,01337cim a22003852u 4500
3600512,20151214182614.0,ss|lmnjluz|nuu,991101s1986 nyunnn l eng d,(NIC)notisASF7577;3600512;(OCoLC)63896169;,NIC,NIC,NIC;NIC;,,"Randel, Don Michael",,,,,,Defining music,,[sound recording],1986.,1 sound cassette (78 min.) :,"analog, mono.","Recorded in Ithaca, NY by Cornell University.;Sponsored by: Society for the Humanities.;",,,,,"Lecture, February 19, 1986.","Randel explains how musicologists define ""Western art
                music"" and mentions some of the problems scholars have with music
                definition.",No reproductions authorized.,,,,,,,,,,,,,,,,,,,,,,,,,,,,,,,,,,,,,,,Music;Music.;Musicology;,Periodicals.,Terminology.,,,(OCoLC)fst01030269;(OCoLC)fst01030893;,fast;fast;,Music;Musicology;,,,,,,,,,,(OCoLC)fst01411641;(OCoLC)fst01423880;,fast;fast;,Periodicals;Terminology;,,,,,,,,,,CULectures,20000114120000.0,20141221,m,batch,lts,addfast,01223cim a22003492u 4500
3600513,20151214182614.0,ss|lmnjluz|nuu,991101s1986 nyunnn l eng d,(NIC)notisASF7578;3600513;(OCoLC)63896171;,NIC,NIC,NIC;NIC;,,"McCleary, Peter.",,,,,,The metamorphosis of perception through production,,[sound recording],1986.,1 sound cassette (80 min.) :,"analog, mono.","Recorded in Ithaca, NY by Cornell University.;Sponsored by: History and Philosophy of Science and Technology,
                Program in the.;",,,,,"Lecture, February 19, 1986.","McCleary discusses technology, emphasizing architecture, and its
                interaction with society. He proposes that experience and knowledge of the world is
                through ""levels of mediation with the physical world"".",No reproductions authorized.,,,,,,,,,,,,,,,,,,,,,,,,,,,,,,,,,,,,,fast,1900 - 1999,"Architecture and society.;Technology;Existentialism.;Philosophy, Modern;",,Social aspects.,20th century.,,(OCoLC)fst00813574;(OCoLC)fst00918204;(OCoLC)fst01061071;(OCoLC)fst01145202;,fast;fast;fast;fast;,"Architecture and society;Existentialism;Philosophy, Modern;Technology;",Social aspects,,,,,,,,,,,,,,,,,,,,,CULectures,20000119120000.0,20141221,m,batch,lts,addfast,01514cim a22003732u 4500
3600199,20151214182520.0,ss|lmnjluz|nuu,991101s1986 nyunnn l eng d,(NIC)notisASF7264;3600199;(OCoLC)63895693;,NIC,NIC,NIC,,"Fuentes, Carlos.",,,,,,"Latin America and the West: historical origins and cultural
                contexts--#4: The West we knew",,[sound recording],1986.,1 sound cassette (62 min.) :,"analog, mono.","Recorded in Ithaca, NY by Cornell University.;Accompanied by: Notes.;Sponsored by: Society for the Humanities.;Speaker(s): Fuentes is a noted Mexican author and critic.;",,,,,"Lecture, February 24, 1986.","Fuentes looks at the Spanish legacy of Latin America and the
                situation at the end of the 15th century and beginning of the 16th
                century.",No reproductions authorized.,,,,,,,,,,,,,,,,,,,,,,,,,,,,,,,,,,,,,,,,,,,,(OCoLC)fst00862898;(OCoLC)fst01069781;,fast;fast;,Civilization;Political science;,,Latin America;Latin America;Latin America;,Civilization.;History.;Politics and government.;,,,(OCoLC)fst01245945,fast,Latin America,,(OCoLC)fst01411628,fast,History,,,,,,,,,,CULectures,20000329120000.0,20141221,m,batch,lts,addfast,01462cim a22003732u 4500
3600496,20151214182611.0,ss|lmnjluz|nuu,991101s1986 nyunnn l eng d,(NIC)notisASF7561;3600496;(OCoLC)63896143;,NIC,NIC,NIC;NIC;,,"Vlastos, Gregory.",,,,,,Socrates' contra Socrates' in Plato,,[sound recording],1986.,1 sound cassette (70 min.) :,"analog, mono.","Recorded in Ithaca, NY by Cornell University.;Sponsored by: Classics, Department of.;",,,,,"Lecture, February 25, 1986.","Vlastos claims that there are two different Socrates, one which might
                be called ""historical"" and the other which might be called
                ""philosophical"". He asserts that the ""second"" Socrates is
                prevalent in Plato's writings.",,Socrates.;Plato.;,,,(OCoLC)fst00046610;(OCoLC)fst00035600;,fast;fast;,Plato;Socrates;,,,,,,,,,,,,,,,,,,,,,,,,,,,,,,,,,"Philosophy, Ancient.",,,,,(OCoLC)fst01060860,fast,"Philosophy, Ancient",,,,,,,,,,,,,,,,,,,,Cornell studies in classical philology.,Townsend lectures.,CULectures,20000404120000.0,20141221,m,batch,lts,addfast,01294cim a22003372u 4500
3600401,20151214182555.0,ss|lmnjluz|nuu,991101s1986 nyunnn l eng d,(NIC)notisASF7466;3600401;(OCoLC)63895996;,NIC,NIC,NIC,,"Ehrenreich, Barbara.",,,,,,The feminist movement today: a historical perspective,,[sound recording],1986.,1 sound cassette (80 min.) :,"analog, mono.","Recorded in Ithaca, NY by Cornell University.;Sponsored by: Women's Studies Program,Telluride
                Association.;",,,,,"Lecture, March 10, 1986.","Ehrenreich talks about the gains women have made through the feminist
                movement but focuses mainly on the problems that women still face, particularly
                abortion, sexuality, and economic rights.",,,,,,,,,,,,,,,,,,,,,,,,,,,,,,,,,,,,,,,,Feminism.;Women's rights.;,,,,,(OCoLC)fst00922671;(OCoLC)fst01178818;,fast;fast;,Feminism;Women's rights;,,,,,,,,,,,,,,,,,,,,,,CULectures,19991201120000.0,20141221,m,batch,lts,addfast,01146cim a22003012u 4500
3600203,20151214182521.0,ss|lmnjluz|nuu,991101s1986 nyunnn l eng d,(NIC)notisASF7268;3600203;(OCoLC)63895700;,NIC,NIC,NIC,,"Fuentes, Carlos.",,,,,,"Latin America and the West: historical origins and cultural
                contexts--#8: The revolutions of independence",,[sound recording],1986.,1 sound cassette (46 min.) :,"analog, mono.","Recorded in Ithaca, NY by Cornell University.;Accompanied by: Notes.;Sponsored by: Society for the Humanities.;Speaker(s): Fuentes is a noted Mexican author and critic.;",,,,,"Lecture, March 31, 1986.","Fuentes describes the turmoil and reforms of 18th century Spain and
                how they contributed to a loss of power over Spanish lands in the New World,
                resulting in the wars leading to the independence of Latin America from
                Spain.",No reproductions authorized.,,,,,,,,,,,,,,,,,,,,,,,,,,,,,,,,,,,,,fast,1700 - 1799,,,,,,(OCoLC)fst00862898;(OCoLC)fst01069781;,fast;fast;,Civilization;Political science;,,Latin America;Latin America;Latin America;Spain;Spain;,Civilization.;History.;Politics and government.;Civilization;History;Revolution of American colonies.;,18th century.,,(OCoLC)fst01245945;(OCoLC)fst01204303;,fast;fast;,Latin America;Spain;,,(OCoLC)fst01411628,fast,History,,,,,,,,,,CULectures,20000405120000.0,20141221,m,batch,lts,addfast,01759cim a22004212u 4500
3600322,20151214182541.0,ss|lmnjluz|nuu,991101s1986 nyunnn l eng d,(NIC)notisASF7387;3600322;(OCoLC)63895874;,NIC,NIC,NIC;NIC;,,"Vlastos, Gregory.",,,,,,Socratic rejection of the Lex talionis,,[sound recording],1986.,1 sound cassette (60 min.) :,"analog, mono.","Recorded in Ithaca, NY by Cornell University.;Accompanied by: Text;Notes.;Sponsored by: Classics, Department of.;",,,,,"Lecture, April 1, 1986.","Vlastos describes the conflict between the views of Socrates and the
                Lex Talionis, the ancient doctrine of retaliation.",,Socrates.,,,(OCoLC)fst00035600,fast,Socrates,,,,,,,,,,,,,,,,,,,,,,,,,,,,,,,,,"Philosophy, Ancient.;Lex talionis.;",,,,,(OCoLC)fst00997009;(OCoLC)fst01060860;,fast;fast;,"Lex talionis;Philosophy, Ancient;",,,,,,,,,,,,,,,,,,,,,,CULectures,20000403120000.0,20141221,m,batch,lts,addfast,01177cim a22003372u 4500
3600236,20151214182529.0,ss|lmnjluz|nuu,991101s1986 nyunnn l eng d,(NIC)notisASF7301;3600236;(OCoLC)63895750;,NIC,NIC,NIC;NIC;,,"Rodriguez, Ali.",,,,,,The situation in El Salvador,,[sound recording],1986.,1 sound cassette (80 min.) :,"analog, mono.","Recorded in Ithaca, NY by Cornell University.;Sponsored by: Education Against Oppression.;Speaker(s): Rodriquez was a trade unionist forced to flee El
                Salvador.;",,,,,"Lecture, April 7, 1986.","Using a translator, Rodriquez describes his own experiences of the
                current chaotic situation in El Salvador.",,,,,,,,,,,,,,,,,,,,,,,,,,,,,,,,,,,,,,,,Labor unions,,,,El Salvador.,(OCoLC)fst00990260;(OCoLC)fst01069781;,fast;fast;,Labor unions;Political science;,,El Salvador,Politics and government.,,,(OCoLC)fst01205530,fast,El Salvador,,,,,,,,,,,,,,CULectures,20000217120000.0,20141221,m,batch,lts,addfast,01207cim a22003252u 4500
3600213,20151214182524.0,ss|lmnjluz|nuu,991101s1986 nyunnn l eng d,(NIC)notisASF7278;3600213;(OCoLC)63895715;,NIC,NIC,NIC;NIC;,,"Kishwar, Madhu.",,,,,,The women's movement in India,,[sound recording],1986.,2 sound cassettes (100 min.) :,"analog, mono.","Recorded in Ithaca, NY by Cornell University.;Sponsored by: Cornell India Association.;Speaker(s): Editor of ""Manushi"".;",,,,,"Lecture, July 31, 1986.","Kishwar describes the goals and works of ""Manushi,"" an
                Indian journal about women and society, and answers questions concerning civil
                rights problems in India.",,,,,,,,,,,,,,,,,,,,,,,,,,,,,,,,,,,,,,,,Women's rights;Minorities;,,,,India.;India.;,(OCoLC)fst01023088;(OCoLC)fst01122498;(OCoLC)fst01178818;,fast;fast;fast;,Minorities;Social history;Women's rights;,,India,Social conditions.,,,(OCoLC)fst01210276,fast,India,,,,,,,,,,,,,,CULectures,20000414120000.0,20141221,m,batch,lts,addfast,01285cim a22003492u 4500
3600211,20151214182524.0,ss|lmnjluz|nuu,991101s1986 nyunnn l eng d,(NIC)notisASF7276;3600211;(OCoLC)63895712;,NIC,NIC,NIC;NIC;,,"Ḥabībī, Imīl.",,,,,,The Palestinian as Israeli citizen,,[sound recording],1986.,2 sound cassettes (100 min.) :,"analog, mono.","Recorded in Ithaca, NY by Cornell University.;Sponsored by: Palestine Human Rights Committee (PHRC).;Speaker(s): Habiby is a founding member of the Palestinian Communist
                Party and editor- in-chief of the largest Arabic paper in Israel.;",,,,,"Lecture, October 29, 1986.","Habiby traces the history of a systematic policy of the State of
                Israel from 1948 to the present of eliminating Arabs from Israel.",,,,,,,,,,,,,,,,,,,,,,,,,,,,,,,,,,,,,,,,Palestinian Arabs,,,Israel.,,(OCoLC)fst01051590;(OCoLC)fst01069781;,fast;fast;,Palestinian Arabs;Political science;,,Israel,Politics and government.,,,(OCoLC)fst01204236,fast,Israel,,,,,,,,,,,,,,CULectures,20000425120000.0,20141221,m,batch,lts,addfast,01316cim a22003252u 4500
3600161,20151214182512.0,ss|lmnjluz|nuu,991101s1986 nyunnn l eng d,(NIC)notisASF7226;3600161;(OCoLC)63895638;,NIC,NIC,NIC,,"Kahane, Meir.",,,,,,Speaking at Cornell,,[sound recording],1986.,1 sound cassette (65 min.) :,"analog, mono.","Recorded in Ithaca, NY by Cornell University.;Accompanied by: Notes.;Sponsored by: Jewish Awareness Network.;Speaker(s): Lecturer founded the Jewish Defense League and is a
                member of Israel's parliament, the Knesset.;",,,,,"Lecture, November 16, 1986.","Kahane presents his views on the state of Israel and the presence of
                Arabs in Israel while responding to a hostile, heckling crowd.",,,,,,,,,,,,,,,,,,,,,,,,,,,,,,,,,,,,,,,,Jewish nationalism.;Jews;Zionism.;,,Identity.,,,(OCoLC)fst00982863;(OCoLC)fst00983278;(OCoLC)fst01184468;,fast;fast;fast;,Jewish nationalism;Jews;Zionism;,Identity,,,,,,,,,,,,,,,,,,,,,CULectures,19991201120000.0,20141221,m,batch,lts,addfast,01285cim a22003492u 4500
3600091,20151214182500.0,ss|lmnjluz|nuu,991101s1987 nyunnn l eng d,(NIC)notisASF7156;3600091;(OCoLC)63895511;,NIC,NIC,NIC;NIC;,,"Chomsky, Noam.",,,,,,"U.S. international and security policy: the right turn' in
                historical perspective",,[sound recording],1987.,1 sound cassette :,"analog, mono.","Recorded in Ithaca, NY by Cornell University.;Accompanied by: Notes.;Sponsored by: Education Against Oppression.;Speaker(s): Lecturer is Professor of Linguistics at Massachusetts
                Institute of Technology, prominent speaker and author in linguistics and social
                issues.;",,,,,"Lecture, February 9, 1987.","Chomsky analyzes the activity of the Reagan administration as a right
                turn' in U.S. government policy, citing such things as a transfer of resources
                from the poor to the wealthy, an increase in state power and economic control, and
                an activist foreign policy.",,,,,,,,,,,,,,,,,,,,,,,,,,,,,,,,,,,,,,fast,Since 1981,,,,,,(OCoLC)fst01907412;(OCoLC)fst01069781;,fast;fast;,Diplomatic relations;Political science;,,United States;United States;,Foreign relations.;Politics and government;,1981-,,(OCoLC)fst01204155,fast,United States,,,,,,,,,,,,,,CULectures,20000412120000.0,20141221,m,batch,lts,addfast,01583cim a22003492u 4500
3600168,20151214182514.0,ss|lmnjluz|nuu,991101s1987 nyunnn l eng d,(NIC)notisASF7233;3600168;(OCoLC)63895647;,NIC,NIC,NIC;NIC;,,"Orlov, Yuri,",,1924-,,,,"Human rights violations in the Soviet Union and El
                Salvador",,[sound recording],1987.,1 sound cassette (85 min.) :,"analog, mono.","Recorded in Ithaca, NY by Cornell University.;Sponsored by: Amnesty International.;Speaker(s): Orlov is a physicist at Cornell who was recently allowed
                to emigrate from the Soviet Union. Dudley is coordinator of CUSLAR.;",,,,,"Panel, February 27, 1987.","The speakers discussed human rights violations in the Soviet Union
                and El Salvador and answered questions from the audience. Orlov used an
                interpreter.",No reproductions authorized.,,,,,,,,,,,,,,,,,,,,,,,,,,,,,,,,,,,,,,,Civil rights;Civil rights;,,,,El Salvador.;Soviet Union.;,(OCoLC)fst00862627,fast,Civil rights,,,,,,(OCoLC)fst01205530;(OCoLC)fst01210281;,fast;fast;,El Salvador;Soviet Union;,,,,,"Dudley, Mary Jo,",,1956-,,,,,,,CULectures,20000225120000.0,20141221,m,batch,lts,addfast,01417cim a22003492u 4500
3600250,20151214182531.0,ss|lmnjluz|nuu,991101s1987 nyunnn l eng d,(NIC)notisASF7315;3600250;(OCoLC)63895774;,NIC,NIC,NIC;NIC;,,"Jordanova, L. J.",,,,,,"Nature unveiling before science: images of women and
                knowledge",,[sound recording],1987.,1 sound cassette (65 min.) :,"analog, mono.","Recorded in Ithaca, NY by Cornell University.;Sponsored by: Society for the Humanities,Women's Studies
                Program.;",,,,,"Lecture, May 1, 1987.","Jordanova formulates a correlation between the unveiling of
                women's bodies and actions in art, science and medicine.",No reproductions authorized.,,,,,,,,,,,,,,,,,,,,,,,,,,,,,,,,,,,,,,,Feminine beauty (Aesthetics);Women in art.;,,,,,(OCoLC)fst00922652;(OCoLC)fst01177826;,fast;fast;,Feminine beauty (Aesthetics);Women in art;,,,,,,,,,,,,,,,,,,,,"Women, science, and the body: discourses and
                representations.",,CULectures,20000331120000.0,20141221,m,batch,lts,addfast,01241cim a22003252u 4500
3600289,20151214182537.0,ss|lmnjluz|nuu,991101s1987 nyunnn l eng d,(NIC)notisASF7354;3600289;(OCoLC)63895831;,NIC,NIC,NIC,,"Lowi, Theodore J.",,,,,,"What is there about the White House that makes its occupants want to
                do bad things?",,[sound recording],1987.,1 sound cassette (86 min.) :,"analog, mono.","Recorded in Ithaca, NY by Cornell University.;Sponsored by: Summer Session, Extramural Study, and Related Programs,
                Division of.;Speaker(s): Professor of Government, Cornell University.;",,,,,"Lecture, July 8, 1987.","Lowi argues that deception and bad policy making in the Executive
                Branch arise from the cold war culture and the plebiscitory presidency.",,,,,,,,,,,,,,,,,,,,,,,,,,,,,,,,,,,,,,,,Presidents,,,,United States.,(OCoLC)fst01069781;(OCoLC)fst01075723;,fast;fast;,Political science;Presidents;,,United States,Politics and government.,,,(OCoLC)fst01204155,fast,United States,,,,,,,,,,,,,,CULectures,20000404120000.0,20141221,m,batch,lts,addfast,01314cim a22003252u 4500
3600415,20151214182558.0,ss|lmnjluz|nuu,991101s1987 nyunnn l eng d,(NIC)notisASF7480;3600415;(OCoLC)63896019;,NIC,NIC,NIC;NIC;,,"Salo, Arvo.",,,,,,The autonomy of the arts and the administration of culture,,[sound recording],1987.,1 sound cassette (77 min.) :,"analog, mono.","Recorded in Ithaca, NY by Cornell University.;Accompanied by: Notes.;Sponsored by: Western Societies Program.;Speaker(s): Mellon Visiting Fellow of the Western Societies Program;
                Finnish journalist, dramatist, poet, and politician; Artist-Professor at the
                University of Finland.;",,,,,"Lecture, September 25, 1987.",Salo discusses the state supported art system in Finland.,,,,,,,,,,,,,,,,,,,,,,,,,,,,,,,,,,,,,,,,"Arts, Finnish.;Arts;",,Management,,Finland.,(OCoLC)fst00818015;(OCoLC)fst00817771;,fast;fast;,"Arts, Finnish;Arts;",Management,,,,,(OCoLC)fst01205503,fast,Finland,,,,,,,,,,,,,,CULectures,20000121120000.0,20141221,m,batch,lts,addfast,01294cim a22003372u 4500
