3601123,20151214182804.0,ss|lmnjluz|nuu,991101s1984 nyunnn l eng d,(NIC)notisASF8188;3601123;(OCoLC)63897087;,NIC,NIC,NIC,,"Derrida, Jacques.",,,,,,"Invention in the nuclear age--no apocalypse, not now",,[sound recording],1984.,2 sound cassettes (75 min.) :,"analog, mono.","Recorded in Ithaca, NY by Cornell University.;Sponsored by: Peace Studies Program,University Lectures
                Committee,Western Societies Program,Arts and Sciences, College of,Women's
                Studies Program,Romance Studies, Department of.;",,,,,"Lecture, April 20, 1984.","Derrida distinguishes between the fiction and reality of nuclear war,
                places the nuclear age within the context of history, and clarifies the role of the
                critic in nuclear discourse.",,,,,,,,,,,,,,,,,,,,,,,,,,,,,,,,,,,,,,,,Inventions.;Nuclear warfare;Discourse analysis.;Semiotics.;,,Social aspects.,,,(OCoLC)fst00894932;(OCoLC)fst00977993;(OCoLC)fst01040951;(OCoLC)fst01112351;,fast;fast;fast;fast;,Discourse analysis;Inventions;Nuclear warfare;Semiotics;,Social aspects,,,,,,,,,,,,,,,,,,,Nuclear criticism.;Diacritics colloquia.;,,CULectures,19991201120000.0,20141221,m,batch,lts,addfast,01538cim a22003732u 4500
3601191,20151214182813.0,ss|lmnjluz|nuu,991101s1984 nyunnn l eng d,(NIC)notisASF8256;3601191;(OCoLC)63897201;,NIC,NIC,NIC,,"Habermas, Jurgen.",,,,,,Dionysics vs. romantic,,[sound recording],1984.,1 sound cassette (72 min.) :,"analog, mono.","Recorded in Ithaca, NY by Cornell University.;Speaker(s): Professor of sociology at the Frankfurt School, West
                Germany.;",,,,,"Lecture, September 6, 1984.","Habermas analyzes the philosophical discourse surrounding modernity
                and postmodernity.",,,,,,,,,,,,,,,,,,,,,,,,,,,,,,,,,,,,,,fast,1700 - 1899,Philosophy;Modernism (Literature).;Social science;,,History;Philosophy.;,18th and 19th century.,,(OCoLC)fst01024455;(OCoLC)fst01060777;,fast;fast;,Modernism (Literature);Philosophy;,,,,,,,,,,(OCoLC)fst01411628,fast,History,,,,,,,,"The Philosophical discourse on modernity and postmodernity.
            ;Messenger lectures.;",,CULectures,20000508120000.0,20141221,m,batch,lts,addfast,01316cim a22003612u 4500
3601190,20151214182813.0,ss|lmnjluz|nuu,991101s1984 nyunnn l eng d,(NIC)notisASF8255;3601190;(OCoLC)63897200;,NIC,NIC,NIC,,"Habermas, Jurgen.",,,,,,The Triple heritage of Nietzsche,,[sound recording],1984.,1 sound cassette (70 min.) :,"analog, mono.","Recorded in Ithaca, NY by Cornell University.;Speaker(s): Professor of sociology at the Frankfurt School, West
                Germany.;",,,,,"Lecture, September 7, 1984.","Habermas examines Nietzsche's interpretations of the modernity
                and postmodernity debate.",,,,,,,,,"Nietzsche, Friedrich Wilhelm,",1844-1900 ,,,,(OCoLC)fst00031611,fast,"Nietzsche, Friedrich Wilhelm,",1844-1900,,,,,,,,,,,,,,,,,,,,,fast,1700 - 1899,Philosophy;Social science;,,History;Philosophy.;,18th and 19th century.,,(OCoLC)fst01060777,fast,Philosophy,,,,,,,,,,(OCoLC)fst01411628,fast,History,,,,,,,,"The philosophical discourse on modernity and
                postmodernity.;Messenger lectures.;",,CULectures,20000508120000.0,20141221,m,batch,lts,addfast,01363cim a22003612u 4500
3601188,20151214182813.0,ss|lmnjluz|nuu,991101s1984 nyunnn l eng d,(NIC)notisASF8253;3601188;(OCoLC)63897198;,NIC,NIC,NIC;NIC;,,"Habermas, Jurgen.",,,,,,Heidegger's overcoming of occidental rationalism,,[sound recording],1984.,1 sound cassette (62 min.) :,"analog, mono.","Recorded in Ithaca, NY by Cornell University.;Speaker(s): Professor of sociology at the Frankfurt School, West
                Germany.;",,,,,"Lecture, September 10, 1984.","Habermas discusses the theories of Heidegger and their relation to
                modernity, postmodernity and rationalism.",,,,,,,,,"Heidegger, Martin,",1889-1976.,,,,(OCoLC)fst00032385,fast,"Heidegger, Martin,",1889-1976,,,,,,,,,,,,,,,,,,,,,fast,1900 - 1999,"Social science;Philosophy, Modern;Rationalism.;",,Philosophy.,20th century.,,(OCoLC)fst01061071;(OCoLC)fst01090275;,fast;fast;,"Philosophy, Modern;Rationalism;",,,,,,,,,,,,,,,,,,,,"The philosophical discourse on modernity and
                postmodernity.;Messenger lectures.;",,CULectures,20000508120000.0,20141221,m,batch,lts,addfast,01414cim a22003732u 4500
3601185,20151214182813.0,ss|lmnjluz|nuu,991101s1984 nyunnn l eng d,(NIC)notisASF8250;3601185;(OCoLC)63897191;,NIC,NIC,NIC;NIC;,,"Habermas, Jurgen.",,,,,,Bataille: between eroticism and economy of nature,,[sound recording],1984.,2 sound cassettes (105 min.) :,"analog, mono.","Recorded in Ithaca, NY by Cornell University.;Speaker(s): Professor of sociology at the Frankfurt School, West
                Germany.;",,,,,"Lecture, September 11, 1984.","Habermas examines Bataille's views on modernity, postmodernity,
                and social theory.",,,,,,,,,"Bataille, Georges,",1897-1962.,,,,(OCoLC)fst00008540,fast,"Bataille, Georges,",1897-1962,,,,,,,,,,,,,,,,,,,,,fast,1900 - 1999,"Social science;Philosophy, Modern;",,Philosophy.,20th century.,,(OCoLC)fst01061071,fast,"Philosophy, Modern",,,,,,,,,,,,,,,,,,,,"The philosophical discourse on modernity and
                postmodernity.;Messenger lectures.;",,CULectures,20000508120000.0,20141221,m,batch,lts,addfast,01308cim a22003492u 4500
3601184,20151214182813.0,ss|lmnjluz|nuu,991101s1984 nyunnn l eng d,(NIC)notisASF8249;3601184;(OCoLC)63897189;,NIC,NIC,NIC;NIC;,,"Certeau, Michel de.",,,,,,"Sixteenth and seventeenth century Spanish and French mysticism, part
                1",,[sound recording],1984.,1 sound cassette (85 min.) :,"analog, mono.","Recorded in Ithaca, NY by Cornell University.;Sponsored by: Society for the Humanities.;",,,,,"Lecture, September 12, 1984.","deCerteau discusses literary mysticism in 16th and 17th century Spain
                and France.",,,,,,,,,,,,,,,,,,,,,,,,,,,,,,,,,,,,,,fast,1500 - 1799,Mysticism in literature.;Spanish literature;French literature;,,,"Classical period, 1500-1700.;17th and 18th century.;",,(OCoLC)fst00934688;(OCoLC)fst01031668;(OCoLC)fst01711000;,fast;fast;fast;,French literature;Mysticism in literature;Spanish literature;,Classical period,,,,,,,,,,,,,,,,,,,,,CULectures,20000303120000.0,20141221,m,batch,lts,addfast,01279cim a22003372u 4500
3601183,20151214182813.0,ss|lmnjluz|nuu,991101s1984 nyunnn l eng d,(NIC)notisASF8248;3601183;(OCoLC)63897187;,NIC,NIC,NIC;NIC;,,"Habermas, Jurgen.",,,,,,Foucault's unmasking of the human sciences,,[sound recording],1984.,1 sound cassette (90 min.) :,"analog, mono.","Recorded in Ithaca, NY by Cornell University.;Speaker(s): Professor of sociology at the Frankfurt School, West
                Germany.;",,,,,"Lecture, September 12, 1984.","Habermas examines the role of society in creating sciences'
                ""great men"".",,,,,,,,,"Foucault, Michel,",1926-1984.,,,,(OCoLC)fst01427415,fast,"Foucault, Michel,",1926-1984,,,,,,,,,,,,,,,,,,,,,fast,1900 - 1999,"Philosophy, Modern;Social science;",,Philosophy.,20th century.,,(OCoLC)fst01061071,fast,"Philosophy, Modern",,,,,,,,,,,,,,,,,,,,"The philosophical discourse on modernity and
                postmodernity.;Messenger lectures.;",,CULectures,20000508120000.0,20141221,m,batch,lts,addfast,01287cim a22003492u 4500
3601213,20151214182816.0,ss|lmnjluz|nuu,991101s1984 nyunnn l eng d,(NIC)notisASF8278;3601213;(OCoLC)63897232;,NIC,NIC,NIC;NIC;,,"Thomas, Helen,",,1920- ,,,,The final fifty days of the presidential campaign,,[sound recording],1984.,1 sound cassette (60 min.) :,"analog, mono.","Recorded in Ithaca, NY by Cornell University.;Speaker(s): Thomas is a journalist who covers the White
                House.;",,,,,"Lecture, September 17, 1984.","Thomas outlines the last days of the 1984 presidential campaign,
                discusses Reagan as President, and explains the relationship of the media with the
                President, in general, and with Reagan, in particular.",,,,,,,,,,,,,,,,,,,,,,,,,,,,,,,,,,,,,,,,"Elections;Presidents;Politics, Practical.;",,Election.,,United States.;United States;,(OCoLC)fst00904324;(OCoLC)fst01069977;(OCoLC)fst01075747;,fast;fast;fast;,"Elections;Politics, Practical;Presidents;",Election,,,,,(OCoLC)fst01204155,fast,United States,,,,,,,,,,,,,,CULectures,20000329120000.0,20141221,m,batch,lts,addfast,01365cim a22003372u 4500
3604597,20151214183428.0,ss|lmnjluz|nuu,991101s1984 nyunnn l eng d,(NIC)notisASG1662;3604597;(OCoLC)63903051;,NIC,NIC,NIC;NIC;,,"Dover, K. J.",,1920-2010.,"(Kenneth James),",,,Homosexuality and initiation in ancient Greece,,[sound recording],1984.,1 sound cassette (75 min.) :,"analog, mono.","Recorded in Ithaca, NY by Cornell University.;Sponsored by: Andrew D. White Professors-At-Large Program.;",,,,,"Lecture, September 18, 1984.","Dover discusses representations of and interest in homosexuality in
                ancient Greece, particularly relating to adolescent initiation into
                adulthood.",,,,,,,,,,,,,,,,,,,,,,,,,,,,,,,,,,,,,,fast,To 146 B.C.,Homosexuality.;Greece;,,History,To 146 B.C.,,(OCoLC)fst00959755,fast,Homosexuality,,,,,,,,,,(OCoLC)fst01411628,fast,History,,,,,,,,Andrew D. White Professors-At-Large lectures.,,CULectures,20000407120000.0,20141221,m,batch,lts,addfast,01235cim a22003252u 4500
3601232,20151214182818.0,ss|lmnjluz|nuu,991101s1984 nyunnn l eng d,(NIC)notisASF8297;3601232;(OCoLC)63897261;,NIC,NIC,NIC;NIC;,,"Certeau, Michel de.",,,,,,"Sixteenth and seventeenth century Spanish and French mysticism, part
                2",,[sound recording],1984.,2 sound cassettes (120 min.) :,"analog, mono.","Recorded in Ithaca, NY by Cornell University.;Accompanied by: Notes.;Sponsored by: Society for the Humanities.;",,,,,"Lecture, September 19, 1984.","deCerteau discusses the development of mysticism in Spain and
                France.",,,,,,,,,,,,,,,,,,,,,,,,,,,,,,,,,,,,,,fast,1500 - 1699,Mysticism.,,,,,(OCoLC)fst01031629,fast,Mysticism,,Spain;Spain;France;France;,History;History;History;History;,16th century.;17th century.;16th century.;17th century.;,,(OCoLC)fst01204289;(OCoLC)fst01204303;,fast;fast;,France;Spain;,,,,,,,,,,,,,,CULectures,20000414120000.0,20141221,m,batch,lts,addfast,01301cim a22003732u 4500
3601231,20151214182818.0,ss|lmnjluz|nuu,991101s1984 nyunnn l eng d,(NIC)notisASF8296;3601231;(OCoLC)63897260;,NIC,NIC,NIC;NIC;,,"Anderson, Benedict R. O'G.",,1936-2015.,"(Benedict Richard O'Gorman),",,,"Language, literature, and national consciousness",,[sound recording],1984.,2 sound cassettes (110 min.) :,"analog, mono.","Recorded in Ithaca, NY by Cornell University.",,,,,"Panel, September 21, 1984.","Panel members discuss the interrelationship between language,
                literature and nationalism.",,,,,,,,,,,,,,,,,,,,,,,,,,,,,,,,,,,,,,,,Nationalism.;Language and languages;,,Political aspects.,,,(OCoLC)fst00992197;(OCoLC)fst01033832;,fast;fast;,Language and languages;Nationalism;,Political aspects,,,,,,,,,,,,"Weiss, John Hubbel.;Kramnick, Isaac.;Cohen, Walter,;",,1949-,,,,,,,CULectures,20000406120000.0,20141221,m,batch,lts,addfast,01186cim a22003252u 4500
3601134,20151214182806.0,ss|lmnjluz|nuu,991101s1984 nyunnn l eng d,(NIC)notisASF8199;3601134;(OCoLC)63897109;,NIC,NIC,NIC;NIC;,,"Certeau, Michel de.",,,,,,"Sixteenth and seventeenth century Spanish and French mysticism, part
                4",,[sound recording],1984.,2 sound cassettes (105 min.) :,"analog, mono.","Recorded in Ithaca, NY by Cornell University.;Sponsored by: Society for the Humanities.;",,,,,"Lecture, October 3, 1984.","de Certeau analyzes Juan de la Cruz's poetry in light of Spanish
                mysticism.",,,,,,,,,,,,,,,,,,,,,,,,,,,,,,,,,,,,,,fast,1500 - 1700,Mysticism in literature.;Literature;Comparative literature;Spanish literature;French literature;,,"History and criticism.;Themes, motives.;","Classical period, 1500-1700.;16th and 17th centuries.;",,(OCoLC)fst01735633;(OCoLC)fst00934688;(OCoLC)fst00999953;(OCoLC)fst01031668;(OCoLC)fst01711000;,fast;fast;fast;fast;fast;,Comparative literature;French literature;Literature;Mysticism in literature;Spanish literature;,"Themes, motives;Classical period;",,,,,,,,,(OCoLC)fst01411635,fast,"Criticism, interpretation, etc.",,,,,,,,,,CULectures,20000303120000.0,20141221,m,batch,lts,addfast,01591cim a22003972u 4500
3601227,20151214182818.0,ss|lmnjluz|nuu,991101s1984 nyunnn l eng d,(NIC)notisASF8292;3601227;(OCoLC)63897254;,NIC,NIC,NIC;NIC;,,"Certeau, Michel de.",,,,,,"Sixteenth and seventeenth century Spanish and French mysticism, part
                3",,[sound recording].,1984.,2 sound cassettes (130 min.) :,"analog, mono.","Recorded in Ithaca, NY by Cornell University.;Accompanied by: Notes.;Sponsored by: Society for the Humanities.;",,,,,"Lecture, September 26, 1984.","In his third lecture of the series, Certeau discusses ""higher
                literature"", its mystical content, and interpretations of it in 17th and 18th
                century Europe.",,,,,,,,,,,,,,,,,,,,,,,,,,,,,,,,,,,,,,fast,1500 - 1699,Mysticism.;Mysticism in literature.;,,,,,(OCoLC)fst01031629;(OCoLC)fst01031668;,fast;fast;,Mysticism;Mysticism in literature;,,Spain;Spain;France;France;,History;History;History;History;,16th century.;17th century.;16th century.;17th century.;,,(OCoLC)fst01204289;(OCoLC)fst01204303;,fast;fast;,France;Spain;,,,,,,,,,,,,,,CULectures,20000414120000.0,20141221,m,batch,lts,addfast,01495cim a22003972u 4500
3601203,20151214182815.0,ss|lmnjluz|nuu,991101s1984 nyunnn l eng d,(NIC)notisASF8268;3601203;(OCoLC)63897216;,NIC,NIC,NIC;NIC;,,"Ikiriye, Akira.",,,,,,The westernization of Japan,,[sound recording],1984.,1 sound cassette (39 min.) :,"analog, mono.","Recorded in Ithaca, NY by Cornell University.;Sponsored by: China- Japan Program.;",,,,,"Lecture, September 28, 1984.","Ikiriye discusses the increasing influence of Western culture on
                Japanese society.",,,,,,,,,,,,,,,,,,,,,,,,,,,,,,,,,,,,,,fast,1900 - 1999,,,,,,(OCoLC)fst01122498,fast,Social history,,Japan;Japan;,Social conditions.;Occidental influences;,20th century.,,(OCoLC)fst01204082,fast,Japan,,,,,,,,,,,,,,CULectures,20000428120000.0,20141221,m,batch,lts,addfast,01065cim a22003132u 4500
3601137,20151214182806.0,ss|lmnjluz|nuu,991101s1984 nyunnn l eng d,(NIC)notisASF8202;3601137;(OCoLC)63897112;,NIC,NIC,NIC;NIC;,,"Pempel, Alice McDowell.",,,,,,"Spirituality, femininity, and world community",,[sound recording],1984.,1 sound cassette (65 min.) :,"analog, mono.","Recorded in Ithaca, NY by Cornell University.;Sponsored by: Center for World Community,Interreligious International
                Ministries Committee (IRIM).;",,,,,"Lecture, October 3, 1984.","Pempel discusses yin and yang, or feminine and masculine
                characteristics, and the need for more yin in our society. She asserts that we must
                begin to concentrate more on being than on doing and to make time for
                solitude.",,,,,,,,,,,,,,,,,,,,,,,,,,,,,,,,,,,,,,,,Yin-yang.;Spiritual life.;Femininity (Philosophy);,,,,,(OCoLC)fst00922662;(OCoLC)fst01130100;(OCoLC)fst01182853;,fast;fast;fast;,Femininity (Philosophy);Spiritual life;Yin-yang;,,,,,,,,,,,,,,,,,,,,America and the world community.,,CULectures,20000331120000.0,20141221,m,batch,lts,addfast,01369cim a22003372u 4500
3601138,20151214182806.0,ss|lmnjluz|nuu,991101s1984 nyunnn l eng d,(NIC)notisASF8203;3601138;(OCoLC)63897114;,NIC,NIC,NIC;NIC;,,"Škvorecký, Josef,",,1924-2012.,,,,Jazz and literary culture in Czechoslovakia today,,[sound recording],1984.,1 sound cassette (61 min.) :,"analog, mono.","Recorded in Ithaca, NY by Cornell University.;Sponsored by: Russian Literature, Department of.;",,,,,"Lecture, October 4, 1984.","Skovorecky discusses the Communist repression of the Czech
                government, especially in the literary and musical fields, since 1968. Particular
                attention is paid to the development of jazz and punk rock music in Czechoslovakia,
                the necessary ideological compromises with the present regime, the domestic sources
                of information on music composed in Czechoslovakia, and the realities of
                ""culture control"" by the authorities in this area.",,,,,,,,,,,,,,,,,,,,,,,,,,,,,,,,,,,,,,fast,1945 - 1992,Music;Social history;Jazz.;Politics and literature.;,,,,Czechoslovakia.;Czechoslovakia.;,(OCoLC)fst00982165;(OCoLC)fst01030269;(OCoLC)fst01069960;(OCoLC)fst01122498;,fast;fast;fast;fast;,Jazz;Music;Politics and literature;Social history;,,Czechoslovakia,Social conditions,1945-1992.,,(OCoLC)fst01212490,fast,Czechoslovakia,,,,,,,,,,,,,,CULectures,20000324120000.0,20141221,m,batch,lts,addfast,01745cim a22003852u 4500
3601141,20151214182807.0,ss|lmnjluz|nuu,991101s1984 nyunnn l eng d,(NIC)notisASF8206;3601141;(OCoLC)63897118;,NIC,NIC,NIC,,"Harris, Robert.",,,,,,The humanities in everyday life and public policy,,[sound recording],1984.,1 sound cassette (90 min.) :,"analog, mono.","Recorded in Ithaca, NY by Cornell University.;Sponsored by: Society for the Humanities.;",,,,,"Lecture, October 5, 1984.","The five speakers discusss topics such as the problems facing
                foreign-language students in American universities, conflicts over the distribution
                of the National Endowment for the Humanities funds, and the need for public
                acknowledgement of foreign cultural concerns by the National Endowment for the
                Humanities.",,,,,,,,,,,,,,,,,,,,,,,,,,,,,,,,,,,,,,,,Education and state.;Education;Humanities.;,,Political aspects.,,,(OCoLC)fst00902835;(OCoLC)fst00902728;(OCoLC)fst00963588;,fast;fast;fast;,Education and state;Education;Humanities;,Political aspects,,,,,,,,,,,,"Stimpson, Catharine R.,;Norton, Mary Beth.;Marshall, Jeffrey.;Lanham, Richard A.;",,1936- ,,,,,,,CULectures,20000327120000.0,20141221,m,batch,lts,addfast,01524cim a22003732u 4500
3601147,20151214182807.0,ss|lmnjluz|nuu,991101s1984 nyunnn l eng d,(NIC)notisASF8212;3601147;(OCoLC)63897128;,NIC,NIC,NIC;NIC;,,"Katzenstein, Mary Fainsod,",,1945-,,,,Assessing Reagan's record: women's concerns,,[sound recording],1984.,1 sound cassette (81 min.) :,"analog, mono.","Recorded in Ithaca, NY by Cornell University.",,,,,"Lecture, October 9, 1984.","Katzenstein speaks of Reagan's attempts to reestablish the
                patriarchal family as predominant in the U.S. Feldman speaks of Reagan's
                attempts to curtail federal medical assistance for the elderly, a disproportionate
                number of whom are living in poverty.",,,,,,,,,"Reagan, Ronald.",,,,,(OCoLC)fst00036392,fast,"Reagan, Ronald",,,United States.,President (1981-1989 : Reagan),,,,,,,,,,,,,,,,,,fast,Since 1980,Women;Women;,,"Social conditions;Legal status, laws, etc.;",1980-,United States,(OCoLC)fst01176824;(OCoLC)fst01176947;,fast;fast;,Women;Women;,"Legal status, laws, etc.;Social conditions;",,,,,(OCoLC)fst01204155,fast,United States,,,,,"Feldman, Margaret.",,,,,,,,,CULectures,20000417120000.0,20141221,m,batch,lts,addfast,01501cim a22003612u 4500
3601148,20151214182807.0,ss|lmnjluz|nuu,991101s1984 nyunnn l eng d,(NIC)notisASF8213;3601148;(OCoLC)63897129;,NIC,NIC,NIC;NIC;,,"Certeau, Michel de. ",,,,,,"Sixteenth and seventeenth century Spanish and French mysticism, part
                5",,[sound recording],1984.,2 sound cassettes (105 min.) :,"analog, mono.","Recorded in Ithaca, NY by Cornell University.;Sponsored by: Society for the Humanities.;",,,,,"Lecture, October 10, 1984.","de Certeau discusses the criteria necessary for recognizing mystical
                texts as such and suggests ways in which mystical texts may be analyzed.",,,,,,,,,,,,,,,,,,,,,,,,,,,,,,,,,,,,,,fast,1500 - 1700,Mysticism in literature.;Literature;Spanish literature;French literature;,,History and criticism.,"Classical period, 1500-1700.;16th and 17th centuries.;",,(OCoLC)fst00934688;(OCoLC)fst00999953;(OCoLC)fst01031668;(OCoLC)fst01711000;,fast;fast;fast;fast;,French literature;Literature;Mysticism in literature;Spanish literature;,Classical period,,,,,,,,,(OCoLC)fst01411635,fast,"Criticism, interpretation, etc.",,,,,,,,,,CULectures,20000303120000.0,20141221,m,batch,lts,addfast,01520cim a22003732u 4500
3601159,20151214182808.0,ss|lmnjluz|nuu,991101s1984 nyunnn l eng d,(NIC)notisASF8224;3601159;(OCoLC)63897151;,NIC,NIC,NIC;NIC;,,"Quinones, Riccardo.",,,,,,"Ulysses' brother: the Cain and Abel theme in Dante and
                Machiavelli",,[sound recording],1984.,1 sound cassette (70 min.) :,"analog, mono.","Recorded in Ithaca, NY by Cornell University.",,,,,"Lecture, October 22, 1984.","Quinones describes the history of the Cain and Abel theme in
                literature, emphasizing Dante's use of it in the character of Ulysses and
                Machiavelli's ""revolutionary"" application of it in his
                work.",,"Dante Alighieri,",1265-1321,Symbolism.,(OCoLC)fst00029097,fast,"Dante Alighieri,",1265-1321,"Machiavelli, Niccolo,",1469-1527,,,Symbolism.,(OCoLC)fst00029240,fast,"Machiavelli, Niccolò,",1469-1527,,,,,,,,,,,,,,,,,,,,,,,"Comparative literature;Plots (Drama, novel, etc).;Cain complex.;",,"Themes, motives.",,,(OCoLC)fst00843919;(OCoLC)fst01735633;(OCoLC)fst01067227;(OCoLC)fst01140749;,fast;fast;fast;fast;,"Cain complex;Comparative literature;Plots (Drama, novel, etc.);Symbolism;","Themes, motives",,,,,,,,,,,,,,,,,,,Renaissance colloquia.,,CULectures,20000315120000.0,20141221,m,batch,lts,addfast,01617cim a22003852u 4500
3601174,20151214182811.0,ss|lmnjluz|nuu,991101s1984 nyunnn l eng d,(NIC)notisASF8239;3601174;(OCoLC)63897173;,NIC,NIC,NIC;NIC;,,"Greve, Michael S.",,,,,,Assessing Reagan's record: economic policy,,[sound recording],1984.,1 sound cassette (91 min.) :,"analog, mono.","Recorded in Ithaca, NY by Cornell University.;Sponsored by: Asian-American coalition,University Unions Programming
                Board,Africana Studies and Research Center.;",,,,,"Debate, October 24, 1984.","McAdams points to the weaknesses in Reagan's economic policy
                while Greve defends it. Ranney emphasizes social justice concerns while Jachson
                focuses on the long-term societal effects of Reagan's policies.",,,,,,,,,"Reagan, Ronald.",,,,,(OCoLC)fst00036392,fast,"Reagan, Ronald",,,United States.,President (1981-1989 : Reagan),,,,,,,,,,,,,,,,,,fast,Since 1980,,,,,,(OCoLC)fst00902025;(OCoLC)fst01122498;,fast;fast;,Economic policy;Social history;,,United States;United States;,Economic policy;Social conditions;,1980-;1980-;,,(OCoLC)fst01204155,fast,United States,,,,,"Ranney, Christine K. ;McAdams, Alan.;Jackson, Steven.;",,,,,,,Assessing Reagan's Record.,,CULectures,20000411120000.0,20141221,m,batch,lts,addfast,01649cim a22004092u 4500
3604600,20151214183429.0,ss|lmnjluz|nuu,991101s1984 nyunnn l eng d,(NIC)notisASG1665;3604600;(OCoLC)63903054;,NIC,NIC,NIC,,"Woolhouse, Harold W.",,,,,,"Taking control of evolution: genetic manipulation and its
                consequences for various species",,[sound recording],1984.,1 sound cassette (85 min.) :,"analog, mono.","Recorded in Ithaca, NY by Cornell University.;Sponsored by: Andrew D. White Professors-At-Large Program.;",,,,,"Lecture, October 25, 1984.","Woolhouse describes the way in which scientists produce new hybrids
                by genetic manipulation.",,,,,,,,,,,,,,,,,,,,,,,,,,,,,,,,,,,,,,,,Genetic engineering;Hybridization.;,,Law and legislation.,,,(OCoLC)fst00940036;(OCoLC)fst00964535;,fast;fast;,Genetic engineering;Hybridization;,Law and legislation,,,,,,,,,,,,,,,,,,,Andrew D. White Professors-At-Large lectures.,,CULectures,19991201120000.0,20141221,m,batch,lts,addfast,01209cim a22003132u 4500
3601073,20151214182757.0,ss|lmnjluz|nuu,991101s1984 nyunnn l eng d,(NIC)notisASF8138;3601073;(OCoLC)63897014;,NIC,NIC,NIC;NIC;,,"Goodstein, David B.,",,1932-,,,,"Can social change be achieved through the United States'
                political system?",,[sound recording],1984.,1 sound cassette (60 min.) :,"analog, mono.","Recorded in Ithaca, NY by Cornell University.",,,,,"Lecture, October 30, 1984.","Goodstein discusses social change which has occurred during the past
                20 years and its implications for the U.S. political system.",,,,,,,,,,,,,,,,,,,,,,,,,,,,,,,,,,,,,,,,"Politics, Practical.;Social change.;",,,,,(OCoLC)fst01069781;(OCoLC)fst01069977;(OCoLC)fst01122310;,fast;fast;fast;,"Political science;Politics, Practical;Social change;",,United States,Politics and government.,,,(OCoLC)fst01204155,fast,United States,,,,,,,,,,,,,,CULectures,20000214120000.0,20141221,m,batch,lts,addfast,01234cim a22003252u 4500
3601074,20151214182757.0,ss|lmnjluz|nuu,991101s1984 nyunnn l eng d,(NIC)notisASF8139;3601074;(OCoLC)63897016;,NIC,NIC,NIC;NIC;,,"Kleihues, Josef Paul.",,,,,,Berlin architecture and urban design since 1900,,[sound recording],1984.,1 sound cassette (79 min.) :,"analog, mono.","Recorded in Ithaca, NY by Cornell University.",,,,,"Lecture, October 31, 1984.","Kleihues describes several of the civic designs which were suggested
                for Berlin during the period 1900-1965.",No reproductions authorized.,,,,,,,,,,,,,,,,,,,,,,,,,,,,,,,,,,,,,fast,1900 - 1965,Architecture;City planning;,,,1900-1965.,Germany;Germany;Berlin.;,(OCoLC)fst00813346;(OCoLC)fst00862177;,fast;fast;,Architecture;City planning;,,,,,,(OCoLC)fst01210272;(OCoLC)fst01204829;,fast;fast;,Germany;Germany;,Berlin,,,,,,,,,,,Preston H. Thomas memorial lectures.,,CULectures,20000313120000.0,20141221,m,batch,lts,addfast,01271cim a22003492u 4500
