100,245,511,505,700,518,IsBarnes,Location,formatted_date,formatted_title,Original Folder Name,New Folder Name
,00$aStudio 342 :$bvoice students of Judith Kellock.,"0\$aVoice students of Judith Kellock ; with pianists Blaise Bryski, Frederick Dong, Jeff Cox, and David Rosen.","00$tFrom The sound of music :$tEdelweiss /$rRichard Rogers ;$rOscar Hammerstein II ;$tFrom Tonadillas :$tLa maja de Goya /$rEnrique Granados y Campi{tilde}na (Jos{acute}e David Pag{acute}an, baritone, with Mr. Cox) --$tFrom Die Winterreise :$tIrrlicht ;$tFr{uml}uhlingstraum /$rFranz Schubert (Alexander Reese, baritone ; with Mr. Bryski) --$tFrom Serse :$tSe cangio spoglia ;$tSapr{grave}a delle mie offese /$rGeorge Frideric Handel (Carolyn Rogers, soprano ; with Mr. Bryski) --$tL'invitation au voyage /$rHenri Duparc (Hilary Garnish, soprano, with Mr. Bryski) --$tFrom Manon :$tAdieu, notre petite table /$rJules Massenet ;$tFrom La rondine :$tChi il bel sogno di doretta /$rGiacomo Puccini (Erin Goers, soprano, with Mr. Rosen) --$tFrom Susannah :$tAin't it a pretty night /$rCarlisle Floyd (Annalise Smith, soprano, with Mr. Bryski) --$tFrom La regata veneziana :$tAnzoleta dopo la regata /$rGioacchino Rossini ;$tFrom La boh{grave}eme :$tSi, mi chiamano mimi /$rGiacomo Puccini (Liza Sobel, soprano, with Mr. Dong) --$tIn that morning /$rNathaniel Dett ;$tBeau soir /$rClaude Debussy (Kristina Brooks, soprano ; with Mr. Bryski, piano) --$tFrom Don Giovanni :$tBatti, batti, o bel masetto /$rWolfgang Amadeus Mozart (Marybeth Keiser, soprano ; with Mr. Dong) --$tFrom Folksong arrangements, vol. 4$g(Moore's Irish melodies) :$tThe last rose of summer /$rBenjamin Britten (Nate McEwen, tenor ; with Mr. Bryski) --$t3 songs, op. 10$g(James Joyce).$tRain has fallen ;$tSleep now ;$tI hear an army /$rSamuel Barber (Alexander Cooper, baritone ; with Mr. Cox) --$tAn evening hymn /$rHenry Purcell (Lorraine Fitzmaurice, soprano ; with Mr. Bryski).","1\$aKellock, Judith.;1\$aBryski, Blaise,$eperformer.;1\$aDong, Frederick,$eperformer.;1\$aCox, Jeff,$eperformer.;1\$aRosen, David,$d1938-$eperformer.","\\$oRecorded$d2011 December 4,$pBarnes Hall, Cornell University.",TRUE,Barnes,12/4/11 0:00,Studio 342: voice students of Judith Kellock.,2011124_Voice_Students_of_Judith_Kellock,
,00$aStudent chamber music recital.,0\$aVarious performers.,"00$tFrom Piano quartet in E-flat major, op. 47 :$tSostenuto assai--allegro, ma non troppo ;$tScherzo: molto vivace ;$tAndante cantabile /$rRobert Schumann (Miri Yampolsky, piano ; Gene Hu, violin ; Mallory Stellato, viola ; Kat Agres, cello) --$tFrom Five pieces for two violins and piano :$tPrelude /$rDmitri Shostakovich ;$rarr. Levon Atovmian ;$tFrom Suite for two violins and piano, op. 71 :$tAllegro energico /$rMoritz Moszkowski (Laura Schwartz and Jonathan Park, violins ; Miri Yampolsky, piano) --$t3 songs, op. 10$g(James Joyce).$tRain has fallen ;$tSleep now ;$tI hear an army /$rSamuel Barber (Alexander Cooper, baritone ; Jeff Cox, piano) --$tSechs deutsche Lieder, op. 103.$tSei still mein Herz$g(Carl B.v. Schweitzer) ;$tZwiegesang$g(Robert Reinick) ;$tSehnsucht$g(Emmanuel Geibel) ;$tWiegenlied$g(Hoffmann von Fallersleben) ;$tDas heimliche Lied$g(E. Koch) ;$tWach auf$g(Unbekannt) /$rLouis Spohr (Marybeth Keiser, soprano ; Jeffrey Lau, clarinet ; Frederick Dong, piano) --$tFrom Mirabai songs :$tIt's true, I went to the market ;$tAll I was doing was breathing ;$tDon't go, don't go /$rJohn Harbison (Liza Sobel, soprano ; Frederick Dong, piano) --$tFrom String quartet in G minor, op. 10 :$tAnim{acute}e et tr{grave}es d{acute}ecid{acute}e ;$tAssez vif et bien rythm{acute}e /$rClaude Debussy (Katerina Jeng and Alexandra Gribizis, violins ; Alexander Hallenbeck, viola ; Ryan Allen-Parrot, cello).",,"\\$oRecorded$d2011 December 5,$pBarnes Hall, Cornell University.",TRUE,Barnes,12/5/11 0:00,Student chamber music recital.,20111205_Stu_Cham_Recital,
,00$aPiano students of Xak Bjerken.,0\$aVarious performers.,"00$tFrom Sonata in E-flat major, Hob. XVI:52 :$tAllegro /$rJoseph Haydn (Fred Dong) --$tFrom Sonata no. 2 in A minor, op. 28 :$tAllegro tempesto /$rSergei Prokofiev (Robbie Toha) --$tFrom Intermezzi, op. 117 :$tAndante moderato ;$tAndante non troppo e con molto espressione /$rJohannes Brahms (Tiffany Tsay) --$tFrom Moments musicaux, D. 780 :$tNo. 2 in A-flat major /$rFranz Schubert ;$tFrom Partita no. 6 in E minor, BWV 830 :$tCorrente /$rJohann Sebastian Bach (Shiliu Wang) --$tPreludes, op. 28, nos. 1-8 /$rFr{acute}ed{acute}eric Chopin (Emily Choi) --$tFrom Sonata in D major, op. 28 :$tAllegro /$rLudwig van Beethoven (Jenny Xia) --$tFrom Kinderszenen, op. 15, nos. 1-7 /$rRobert Schumann (Eric Tan) --$tEtude no. 5$g(Toccata) /$rUnsuk Chin (Andrew Zhou) --$tConcert etude no. 3, un sosprio /$rFranz Liszt (Julie Moon) --$tFrom Gaspard de la nuit :$tScarbo /$rMaurice Ravel (Vikram Potdar).","1\$aBjerken, Xak.","\\$oRecorded$d2011 December 6,$pBarnes Hall, Cornell University.",TRUE,Barnes,12/6/11 0:00,Piano students of Xak Bjerken.,2011126_Piano_Students_of_Xak_Bjerken,
,"00$aMiri Yampolsky, piano, Carmit Zori, violin, Hillel Zori, cello.","0\$aMiri Yampolsky, piano ; with guests Carmit Zori, violin ; Hillel Zori, cello.","00$tPiano trio in G major, Hob. XV: 25$g(1795).$tAndante ;$tPoco adagio ;$tRondo all'Ongarese = (""Gypsy rondo"") /$rJoseph Haydn --$tPiano trio in C minor, op. 1, no. 3$g(1794-95).$tAllegro con brio ;$tAndante cantabile con variazioni ;$tMenuetto quasi allegro ;$tFinale: prestissimo /$rLudwig van Beethoven --$tPiano trio in B major, op. 8$g(1854).$tAllegro con brio ;$tScherzo: allegro molto ;$tAdagio ;$tAllegro /$rJohannes Brahms.","1\$aYampolsky, Miri,$eperformer.;1\$aZori, Carmit,$eperformer.;1\$aZori, Hillel,$eperformer.","\\$oRecorded$d2012 January 27,$pBarnes Hall, Cornell University.",TRUE,Barnes,1/27/12 0:00,"Miri Yampolsky, piano, Carmit Zori, violin, Hillel Zori, cello.","20120127_Miri_Yampolsky,_Carmit_Zori_Hillel_Zori",
,"00$aMiri Yampolsky, piano, Hillel Zori, cello.","0\$aMiri Yampolsky, piano ; with guest Hillel Zori, cello.","00$tSonata for cello and piano, op. 4$g(1909-10).$tFantasia: adagio di molto ;$tAllegro con spirito--molto adagio /$rZolt{acute}an Kod{acute}aly --$tMetamorphosen, for cello and piano /$rJoseph Bardanashvili --$tSonata for cello and piano in F major, op. 99$g(1886).$tAllegro vivace ;$tAdagio affettuoso ;$tAllegro passionato ;$tAllegro molto /$rJohannes Brahms.","1\$aYampolsky, Miri,$eperformer.;1\$aZori, Hillel,$eperformer.","\\$oRecorded$d2012 January 29,$pBarnes Hall, Cornell University.",TRUE,Barnes,1/29/12 0:00,"Miri Yampolsky, piano, Hillel Zori, cello.",20120129_Yampolsky_Zori,
"1\$aPalmer, Robert,$d1915-2010.",10$aEnsemble X :$bthe music of Robert M. Palmer.,"0\$aSteven Stucky, director ; various performers.","00$tSonata for violin and piano$g(1956).$tAndante sostenuto ;$tAllegro e molto ritmico ;$tAdagio ;$tAllegro moderato$r(Janey Choi, violin ; Mimi Solomon, piano) --$tSonata for two pianos$g(1944).$tAllegro energio ;$tAndante sostenuto ;$tAllegro giusto$r(Blaise Bryski and Andrew Zhou, pianos) --$tQuintet for clarinet, string trio, and piano$g(1952; rev. 1953).$tPoco lento ma con moto ;$tAllegro molto ;$tAndante grazioso ;$tAllegro vivo$r(Richard MacDowell, clarinet ; Nicholas Di Eugenio, violin ; Wendy Richman, viola ; Heidi Hoffman, cello ; Miri Yampolsky, piano).","1\$aStucky, Steven.","\\$oRecorded$d2012 February 4,$pBarnes Hall, Cornell University.",TRUE,Barnes,2/4/12 0:00,Ensemble X: the music of Robert M. Palmer.,20120204_Ensemble_X,
,"00$aFrederic Lacroix, fortepiano :$blucky 13.","0\$aFrederic Lacroix, fortepiano.","00$tSonata no. 8 in C minor, op. 13$g(Sonata path{acute}etique).$tGrave--allegro di molto e con brio ;$tAdagio cantabile ;$tRondo: allegro /$rLudwig van Beethoven --$tFrom Sonata in D major, op. 13, no. 2 :$tAndante poco adagio ;$tRondo: allegro /$rJan Ladislav Dussek --$tSonata in E minor, op. 13, no. 3.$tAllegro molto ;$tCantabile ;$tPresto /$rLeopold Kozeluch --$tSonata in F minor, op. 13, no. 6.$tAllegro agitato ;$tLargo e sostenuto ;$tPresto /$rMuzio Clementi --$tSonata no. 2 in E-flat major, op. 13.$tAllegro con brio ;$tAdagio con gran espressione ;$tFinale: allegro con spirito /$rJohann Nepomuk Hummel.","1\$aLacroix, Fr{acute}ed{acute}eric,$eperformer.","\\$oRecorded$d2012 February 11,$pBarnes Hall, Cornell University.",TRUE,Barnes,2/11/12 0:00,"Frederic Lacroix, fortepiano: lucky 13.",20120211_Frederic_Lacroix,
,00$aContrapunkt! art concert.,"0\$aLiza Sobel, director ; various performers.","00$tOstinato origami$g(inspired by LaiYee Lori Ho's ""Paper crane coming to life"") /$rPaul Hwang (Andrew Sak, flute ; Terrance Griswold, clarinet ; Jesse Jones, piano ; Chris Demetriou, percussion ; Sarah Hoag, violin ; Katharine McShane, cello ; Patrick Valentino, conductor) --$tSuite for violin, cello, and piano.$tPrelude ;$tAndante$g(inspired by Lindsay Levine's ""Composition 2"") /$rSophia Orzechowski (Sadie Kenny, violin ; Katharine McShane, cello ; Sophia Orzechowski, piano) --$tNot really chronophobia$g(inspired by Jennifer Dumler's ""Sinister smirk"") /$rAlex Hallenbeck (Andrew Sak, flute ; Sadie Kenny, violin ; Katharine McShane, cello ; Patrick Valentino, piano) --$tI. Buzzing and II. barely contained$g(inspired by Roxanne Yamins' installation) /$rLiza Sobel (Liza Sobel, soprano ; Andrew Sak, flute ; Terrance Griswold, clarinets ; Chris Demetriou, percussion ; Jesse Jones, piano ; Sarah Hoag, violin ; Stephen Gorgone, viola ; Katharine McShane, cello ; Patrick Valentino, conductor).","1\$aSobel, Liza,$d1990-","\\$oRecorded$d2012 February 12,$pBarnes Hall, Cornell University.",TRUE,Barnes,2/12/12 0:00,Contrapunkt! art concert.,20120212_Contrapunkt_Art_Concert,
,"00$aAndrew Zhou, piano.","0\$aAndrew Zhou, piano.","00$tFrom Three studies, op. 18 (Sz. 72)$g(1918) :$tAllegro molto /$rB{acute}ela Bart{acute}ok --$tEtude no. 5 (Toccata)$g(2003) /$rUnsuk Chin --$tF{uml}unf Klavierst{uml}ucke, op. 23$g(1920-23).$tSehr langsam ;$tSehr rasch ;$tLangsam ;$tSchwungvoll ;$tWalzer /$rArnold Schoenberg --$tInterludium A$g(1982) /$rIsang Yun --$tAm Grabe Franz Liszts$g(1993) /$rOlivier Greif --$tTwo-handed storytelling, for piano and pre-recorded sounds$g(2012) /$rChristopher Stark --$tThe blue bamboula$g(1980) /$rCharles Wuorinen --$tFrom Pr{acute}eludes, book II :$tLa terrasse des audiences du clair de lune$g(1912) /$rClaude Debussy --$tFrom Mirages, op. 70$g(1920) :$tEt pan, au fond des bl{acute}es lunaires, s'accouda$g({grave}a la m{acute}emoire de Claude Debussy) /$rFlorent Schmitt --$tKlavierst{uml}uck XIV, Geburtstags-Formel$g(1984)$g(""Birthday formula"" from the opera Montag from Licht) /$rKarlheinz Stockhausen --$tW{uml}ustenwanderung$g(1986) /$rWalter Zimmermann.","1\$aZhou, Andrew,$eperformer.","\\$oRecorded$d2012 February 17,$pBarnes Hall, Cornell University.",TRUE,Barnes,2/17/12 0:00,"Andrew Zhou, piano.",20120217_Andrew_Zhou,
,00$aCornell Contemporary Chamber Players.,"0\$aCornell Contemporary Chamber Players ; Niccolo Athens and Peiying Yuan, directors.","00$tTwo-handed storytelling, for piano and pre-recorded sounds /$rChristopher Stark (Andrew Zhou, piano) --$tAfterimage, for solo cello /$rTakuma Itoh (Elinor Frey, cello) --$tKlavierst{uml}uck III /$rCharles Cacioppo (Curt Cacioppo, piano) --$tMeditation on Ming Shan, for piano trio /$rMichael Small (Betty Zhou, violin ; Nan-Cheng Chen, cello ; Sean Chen, piano) --$tI don't recall [Amacord.1] /$rTaylan Cihan (Taylan Cihan, sounds ; Andrew Lucia, visuals) --$tTwo etudes, for solo cello.$tEven spaces ;$tSul tasto /$rJesse Jones (Elinor Frey, cello) --$tPiano trio.$tPreludio ;$tPassacaglia ;$tScherzo finale /$rNiccolo Athens (Betty Zhou, violin ; Nan-Cheng Chen, cello ; Sean Chen, piano).","1\$aAthens, Niccolo,$eperformer.;1\$aYuan, Peiying,$eperformer.","\\$oRecorded$d2012 February 18,$pBarnes Hall, Cornell University.",TRUE,Barnes,2/18/12 0:00,Cornell Contemporary Chamber Players.,20120218_CCCP,
,"00$aJuliana Athayde, violin, Nicholas DiEugenio, violin, Wendy Richman, viola, John Haines-Eitzen, cello, Erik Behr, oboe, Mimi Solomon, piano.","0\$aJuliana Athayde, violin ; Nicholas DiEugenio, violin ; Wendy Richman, viola ; John Haines-Eitzen, cello ; Erik Behr, oboe ; Mimi Solomon, piano.","00$tFrom Deuxi{grave}eme r{acute}ecr{acute}eation de musique, op. 8 :$tOuverture ;$tSarabande ;$tMenuet ;$tBadinage ;$tTambourin /$rJean-Marie Leclair --$tSonata for violin and piano$g(1914).$tCon moto ;$tBallada ;$tAllegretto ;$tAdagio /$rLeos Jan{acute}acek --$tOboe sonata in D major, op. 166$g(1921).$tAndantino ;$tAd libitum--allegretto--ad libitum ;$tMolto allegro /$rCamille Saint-Sa{uml}ens --$tPiano quintet in F minor, op. 14$g(1878-79).$tMolto moderato, quasi lento--allegro ;$tLento, con molto sentimento ;$tAllegro non troppo ma con fuoco /$rC{acute}esar Franck.","1\$aAthayde, Juliana,$eperformer.;1\$aDiEugenio, Nicholas,$d1981-$eperformer.;1\$aRichman, Wendy,$eperformer.;1\$aHaines-Eitzen, John,$eperformer.;1\$aBehr. Erik,$d1978-$eperformer.;1\$aSolomon, Mimi,$eperformer.","\\$oRecorded$d2012 February 21,$pBarnes Hall, Cornell University.",TRUE,Barnes,2/21/12 0:00,"Juliana Athayde, violin, Nicholas DiEugenio, violin, Wendy Richman, viola, John Haines-Eitzen, cello, Erik Behr, oboe, Mimi Solomon, piano.","20120221_Athayde,_DiEugenio,_Richman",
,"00$aGuest artist, Fred Frith, guitar.","0\$aFred Frith, guitar ; Annie Lewandowski, piano.","00$tI. /$rMr. Frith --$tII /$rMr. Frith and Ms. Lewandowski --$tLong as in short, walk as in run /$rFred Frith, Annie Lewandowski.","1\$aFrith, Fred,$eperformer.;0\$aPowerdove$c(Musician),$eperformer.","\\$oRecorded$d2012 February 29,$pBarnes Hall, Cornell University.",TRUE,Barnes,2/29/12 0:00,"Guest artist, Fred Frith, guitar.",20120229_Fred_Frith_Annie_Lewandoski,
,"00$aMimi Solomon, piano.","0\$aMimi Solomon, piano.","00$tTwelve variations on ""Ah, vous dirai-je, Maman,"" K. 265 /$rWolfgang Amadeus Mozart --$tPiano sonata BB 88 (Sz. 80).$tAllegro moderato ;$tSonstenuto e pesante ;$tAllegro molto /$rB{acute}ela Bart{acute}ok --$tPiano sonata no. 3 in F minor, op. 5.$tAllegro maestoso ;$tAndante: andante espressivo--andante molto ;$tScherzo: allegro energico avec trio ;$tIntermezzo (R{uml}uckblick): andante molto ;$tFinale: allegro moderato ma rubato /$rJohannes Brahms.","1\$aSolomon, Mimi,$eperformer.","\\$oRecorded$d2012 March 4,$pBarnes Hall, Cornell University.",TRUE,Barnes,3/4/12 0:00,"Mimi Solomon, piano.",20120304_Mimi_Solomon,
,00$aFestival Chamber Orchestra.,"0\$aFestival Chamber Orchestra ; Chris Younghoon Kim, conductor.","00$tBerceuse mystique = (""Mystical lullaby"") /$rNiccolo Athens (Niccolo Athens, conductor) --$tThrough and through, a fairy tale for female voice and ensemble :$tLullaby /$rPeter Fahey (Judith Kellock, soprano) --$tThreshold /$rJesse Jones (Zach Finkelstein, tenor) --$tPresent tense /$rEric Nathan.","1\$aKim, Chris Younghoon,$econductor.","\\$oRecorded$d2012 March 31,$pBarnes Hall, Cornell University.",TRUE,Barnes,3/31/12 0:00,Festival Chamber Orchestra.,20120331_Festival_Chamber_Orchestra,
,00$aCornell Contemporary Chamber Players,"0\$aCornell Contemporary Chamber Players ; Niccolo Athens and Peiying Yuan, directors ; Talea Ensemble (Erik Carlson, violin ; Chris Gross, cello ; Barry Crawford, flutes ; Rane Moore, clarinets ; Eric Huebner, piano ; Alex Lipowski, percussion ; James Baker, conductor).","00$tTrilling, trilling: idolores$g(2012) /$rPeter Fahey (Ms. Moore ; Mr. Carlson ; Mr. Lipowski ; Mr. Baker) --$tPiano trio$g(2012) /$rTakuma Itoh (Mr. Carlson ; Mr. Gross ; Mr. Heubner ; Mr. Baker) --$tMusic for quartet$g(2012) /$rCharles Cacioppo (Mr. Crawford ; Ms. Moore ; Mr. Gross ; Mr. Lipowski ; Mr. Baker) --$tAdagio severo$g(2012) /$rNiccolo Athens (Ms. Moore ; Mr. Huebner ; Mr. Lipowski ; Mr. Baker) --$tMiscellaneous romance no. 1$g(2012) /$rAmit Gilutz (Ms. Moore ; Mr. Carlson ; Mr. Huebner ; with Mr. Gilutz, electronics).","1\$aAthens, Niccolo,$eperformer.;1\$aYuan, Peiying,$d1984-$eperformer.","\\$oRecorded$d2012 April 15,$pBarnes Hall, Cornell University.",TRUE,Barnes,4/15/12 0:00,Cornell Contemporary Chamber Players,20120415_Cornell_Contemporary_Chamber_Players,
"1\$aBiedermann, Garrett.",10$aSenior honors recital.,"0\$aGarrett Biedermann, composer ; various performers.","00$tPrelude and fugue for trombone quartet$g(2011)$r(Jeff Dunn ; Josh Zimmer ; Eddie Steenstra ; Mike Nave) --$tWinter Hunt$g(2012)$r(Sean Harvey ; Andrew Dobos ; Taylor Eddinger ; and Chris Demetriou, mallet percussion) --$tSymphony no. 1$g(2011-12).$tIntroduction ;$tAdagio ;$tScherzo ;$tFinale$r(The Biedermann Orchestra ; Jonathan Musgrave, conductor).","1\$aBiedermann, Garrett.","\\$oRecorded$d2012 April 15,$pBarnes Hall, Cornell University.",TRUE,Barnes,4/15/12 0:00,Senior honors recital.,20120415_Garrett_Biedermann,
,00$aNew works for string quartet and Gamelan instruments.,0\$aMomenta Quartet ; Cornell Gamelan Ensemble.,"00$tMusic for string quartet$g(2010) /$rCharles Cacioppo (Momenta Quartet) --$tthree blue lotus$g(1994) /$rChristopher J. Miller (Christopher J. Miller) --$tNo name$g(2012) /$rJesse Jones (Momenta Quartet ; Christopher J. Miller, gender ; Christopher Stark, bonang ; Peiying Yuan, gong and kempul) --$tVoid$g(2012) /$rPeiying Yuan (Momenta Quartet ; Christopher J. Miller, gender) --$tthe task of interpretation$g(2012) /$rAmit Gilutz (Momenta Quartet ; Christopher J. Miller, Christopher Stark, Peiying Yuan--gender, gender panerus, slenthem, gong, kempul).",,"\\$oRecorded$d2012 April 18,$pBarnes Hall, Cornell University.",TRUE,Barnes,4/18/12 0:00,New works for string quartet and Gamelan instruments.,20120418_New_Works_for_String_Quartet_Gamelan_Instruments,
"1\$aSobel, Liza,$d1990-",00$aSenior honors thesis.,"0\$aLiza Sobel, composer ; various performers.","00$tRequiem for female choir, chamber orchestra, and soprano soloist.$tIntroitus ;$tKyrie ;$tDies irae ;$tInterlude ;$tLacrimosa ;$tSanctus ;$tBenedictus ;$tAgnus dei /$rLiza Sobel (Lorraine Fitzmaurice, conductor ; Ms. Sobel, soprano).",,"\\$oRecorded$d2012 April 20,$pBarnes Hall, Cornell University.",TRUE,Barnes,4/20/12 0:00,Senior honors thesis.,20120420_Liza_Sobel,
,00$a21st annual Cornell jazz festival.,"0\$aPaul Merrill, director ; with guest ensemble Joe Forrester Trio (Joel Forrester, piano ; David Ambrosio, bass ; Matt Garrity, drums) ; and the Bissett Sextet.",00$tFirm roots /$rCedar Walton --$tBeatrice /$rSam Rivers --$tSeven steps to heaven /$rVictor Feldman --$tPolka dots and moonbeams /$rJimmy Van Heusen/Johnny Burke --$tNutville /$rHorace Silver.,"1\$aMerrill, Paul,$d1972-","\\$oRecorded$d2012 April 21,$pBarnes Hall, Cornell University.",TRUE,Barnes,4/21/12 0:00,21st annual Cornell jazz festival.,20120421_Jazz_Festival,
,00$aCornell Chamber Orchestra.,"0\$aCornell Chamber Orchestra ; Chris Younghoon Kim, conductor.","00$tThree secrets in Maine$g(2010).$tThe running alewives at Damariscotta Mills ;$tCycling South Bristol ;$tIn silence, adrift under Venus, alone (19 June 2010--10:22 p.m., tribute to T.N.) /$rCarter Pann --$tFrom String quartet no. 2, op. 7 (""From the Monkey Mountains"")$g(1925) :$tCoach, coachman and horse (andante) ;$tThe moon and I (largo e misterioso) ;$tWild night (vivace e con fuoco) /$rPavel Haas --$tFrom Symphony no. 5 in C-sharp minor$g(1901-2) :$tAdagietto /$rGustav Mahler.","1\$aKim, Chris Younghoon,$econductor.","\\$oRecorded$d2012 April 22,$pBarnes Hall, Cornell University.",TRUE,Barnes,4/22/12 0:00,Cornell Chamber Orchestra.,20120422_Cornell_Chamber_Orchestra,
,00$aContrapunkt!,"0\$aLiza Sobel and Paul Hwang, directors.","00$tPlunge into the depths of endless despair /$rTevin Conner (Liane Moreau ; Jennifer Warmingham ; Anne Kwok ; and Tevin Conner, flutes) --$tEtude /$rRobert Banks (Robert Banks, piano) --$tEverything will be O.K. /$rJon Eckhaus (Jon Eckhaus, prepared piano ; Ethan Cohen, guitar ; Mario Gutierrez, percussion) --$t4 studies of temperament.$tComforting (segue) ;$tFrantic ;$tGiddy ;$tUnsettling /$rAlexander Hallenbeck (Jeffrey Lau, clarinet ; Alex Gribizis, violin ; Ryan Allen-Parrot, cello).","1\$aSobel, Liza,$d1990-;1\$aHwang, Paul.","\\$oRecorded$d2012 April 28,$pBarnes Hall, Cornell University.",TRUE,Barnes,4/28/12 0:00,Contrapunkt!,20120428_Contrapunkt,
,00$aPiano students of Mimi Solomon and Miri Yampolsky.,0\$aVarious performers.,"00$tKindermarsch, D. 928 /$rFranz Schubert (Nan Xu and Mimi Solomon) --$tIntermezzo in E major, op. 116, no. 7 /$rJohannes Brahms ;$tEtude in C-sharp minor, op. 25, no. 7 /$rFr{acute}ed{acute}eric Chopin (Robert Araujo) --$tIntermezzo in E minor, op. 199, no. 2 ;$tCapriccio in D minor, op. 116, no. 1 /$rBrahms (Qianjing ""Jenny"" Xia) --$tIntermezzo in A major, op. 118, no. 2 ;$tBallade in G minor, op. 118, no. 3 /$rBrahms (Tiffany Tsay) --$tIntermezzo in E minor, op. 116, no. 5 ;$tIntermezzo in E-flat major, op. 117, no. 1 /$rBrahms (Peiying Yuan) --$tIntermezzo in A minor, op. 76, no. 7 /$rBrahms ;$tBallade no. 4 in F minor, op. 52 /$rChopin (Vikram Potdar) --$tMarche Militaire, op. 51, no. 1 /$rSchubert ;$tHungarian dance, WoO 1, no. 1 /$rBrahms (Tiffany Tsay and Qianjing ""Jenny"" Xia) --$tCapriccio in A minor, op. 116, no. 2 ;$tIntermezzo in A minor, op. 118, no. 1 /$rBrahms (Nan Xu) --$tIntermezzo in E-flat minor, op. 118, no. 6 ;$tIntermezzo in C major, op. 119, no. 3 /$rBrahms (Eric Tan) --$tCapriccio in G minor, op. 116, no. 3 ;$tIntermezzo in E major, op. 116, no. 4 /$rBrahms (Shiliu Wang) --$tIntermezzo in C-sharp minor, op. 117, no. 3 /$rBrahms ;$tVariations s{acute}erieuses, op. 54 /$rFelix Mendelssohn (Emily Choi) --$tCapriccio in F-sharp minor, op. 76, no. 1 /$rBrahms (Julie Moon) --$tRomance in F major, op. 118, no. 5 /$rBrahms ;$tFrom Sonata no. 2 in G minor, op. 22 :$tVivacissimo: so rasch wie m{uml}oglich /$rRobert Schumann (Fred Dong).","1\$aSolomon, Mimi.;1\$aYampolsky, Miri.","\\$oRecorded$d2012 April 29,$pBarnes Hall, Cornell University.",TRUE,Barnes,4/29/12 0:00,Piano students of Mimi Solomon and Miri Yampolsky.,20120429_Piano_Students_of_Mimi_Solomon_and_Miri_Yamolsky,
,00$aStudent chamber music recital.,0\$aVarious performers.,"00$tFrom Violin sonata no. 2, op. 27 :$tPrelude: poco vivace /$rEug{grave}ene Ysa{uml}ye (Marit Imsdahl, violin) --$tBallade no. 1, op. 23 /$rFr{acute}ed{acute}eric Chopin (Solveig Imsdahl, piano) --$tFrom Piano trio no. 1 in D minor, op. 49 :$tMolto allegro ed agitato /$rFelix Mendelssohn (Alexandra Gribizis, violin ; Gaelyn Ong, cello ; Tiffany Tsay, piano) --$tFrom 8 pieces for violin and cello, op. 39 :$tCradle song ;$tGavotte /$rReinhold Gli{grave}ere ;$tFrom Duo for violin and cello, after K. 423 :$tAllegro /$rWolfgang Amadeus Mozart (Gene Hu, violin ; Zachary Wu, cello) --$tFrom Sonata no. 3 in D minor for violin and piano, op. 108 :$tAllegro /$rJohannes Brahms (Marit Imsdahl, violin ; Solveig Imsdahl, piano) --$tFrom Piano trio no. 1 in B major, op. 8 :$tAllegro con brio /$rBrahms (Moriah Son, violin ; Vivian Yang, cello ; Emily Choi, piano).",,"\\$oRecorded$d2012 May 7,$pBarnes Hall, Cornell University.",TRUE,Barnes,5/7/12 0:00,Student chamber music recital.,20120507_Student_Chamber_Music_Recital,
,"00$aMusic: cognition technology, society :$belectroacoustic music concert.",0\$aVarious performers.,"00$tHomage to La Monte Young /$rNicholas Cline --$tEcology no. 8 /$rNathan Davis --$tThe rite of judgment /$rNiccola Monopoli --$tHydromancer /$rPeter Van Zandt Lane (Peter Van Zandt Lane, bassoon) --$tZey-glitch /$rEliot Bates ;$rTaylan Cihan (Eliot Bates, oud / electronics ; Taylan Cihan, electronics / speakers elements) --$tMegas diakosmos /$rStelios Manousakis --$tTwo-handed storytelling /$rChistopher Stark (Andrew Zhou, piano).",,"\\$oRecorded$d2012 May 12,$pBarnes Hall, Cornell University.",TRUE,Barnes,5/12/12 0:00,"Music: cognition technology, society: electroacoustic music concert.",20120512_MCTS2,
,00$aMayfest :$bthree generations of Cornell piansts.$pProgram II.,"0\$aXak Bjerken and Miri Yampolsky, artistic directors ; various performers.","00$tSonata no. 3 in F minor, op. 20.$tAllegro moderato ;$tAdagio maestoso ;$tPresto /$rJohann Nepomuk Hummel --$tSonata in F minor, D. 625.$tAllegro ;$tAdagio ;$tAllegro /$rFranz Schubert (Malcolm Bilson) --$tTraced overhead, op. 15$g(1996)$tSursum-- ;$tAetheria-- ;$tChori /$rThomas Ad{grave}es (Andrew Zhou) --$tSonata no. 2 in G minor, op. 22.$tVivacissimo: so rasch wie m{uml}oglich ;$tAndantino ;$tScherzo: sehr rasch und markiert ;$tRondo: presto /$rRobert Schumann (Miri Yampolsky).","1\$aBjerken, Xak.;1\$aYampolsky, Miri.","\\$oRecorded$d2012 May 21,$pBarnes Hall, Cornell University.",TRUE,Barnes,5/21/12 0:00,Mayfest: three generations of Cornell piansts.$pProgram II.,20120521_Mayfest_II,
,00$aMayfest.$pProgram III.,"0\$aXak Bjerken and Miri Yampolsky, artistic directors ; various performers.","00$tLargo for clarinet, violin, and piano$g(1910, revised 1934) /$rCharles Ives (Richard Faria, clarinet ; Ariana Kim, violin ; Andrew Zhou, piano) --$tString trio in C minor, op. 9, no. 3.$tAllegro con spirito ;$tAdagio con espressione ;$tScherzo: allegro molto e vivace ;$tFinale: presto /$rLudwig van Beethoven (Xiao-Dong Wang, violin ; Katherin Murdock, viola ; Zvi Plesser, cello) --$tFrom Jeux d'enfants for piano four hands, op. 22$g(1871).$tLa toupie = (""The top"") ;$tLa poup{acute}ee = (""The doll"") ;$tTrompette et tambour = (""Trumpet and drum"") ;$tLes quarte coins = (""Puss in the corner"") ;$tLe volant = (""The shuttlecock"") ;$tLa bal = (""The ball"") /$rGeorge Bizet (Roger Moseley and Xak Bjerken, piano) --$tPiano trio no. 2 in E minor, op. 67$g(1944).$tAndante--moderato ;$tAllegro con brio ;$tLargo ;$tAllegretto /$rDmitri Shostakovich (Xiao-Dong Wang, violin ; Zvi Plesser, cello ; Miri Yampolsky, piano).","1\$aBjerken, Xak.;1\$aYampolsky, Miri.","\\$oRecorded$d2012 May 22,$pBarnes Hall, Cornell University.",TRUE,Barnes,5/22/12 0:00,Mayfest.$pProgram III.,20120522_Mayfest_III,
