100,245,511,505,700,518,IsBarnes,Location,formatted_date,formatted_title,Original Folder Name,New Folder Name
,"00$aMalcolm Bilson, fortepiano.","0\$aMalcolm Bilson, fortepiano.","00$t11 variations on ""Ein M{uml}adchen oder Weibchen,"" from Mozart's The magic flute : (1805) /$rJohann Baptist Cramer --$tSonata in C major, Hob. XVI/50.$tAllegro ;$tAdagio ;$tAllegro molto /$rJoseph Haydn --$tFantasy and fugue in F minor : (1799) /$rJan Ladislav Dussek --$tSonata in F major, K. 332.$tAllegro ;$tAdagio ;$tAllegro vivace /$rWolfgang Amadeus Mozart --$tSonata in F-sharp minor (unfinished), D. 571.$tAllegro moderato (completion by Malcolm Bilson) /$rFranz Schubert --$tSonata in E-flat major, op. 31, no. 3.$tAllegro ;$tScherzo: allegretto vivace ;$tMenuetto: moderato e grazioso ;$tPresto con fuoco /$rLudwig van Beethoven.","1\$aBilson, Malcolm,$eperformer.","\\$oRecorded$d2009 September 15,$pBarnes Hall, Cornell University.",TRUE,Barnes,9/15/09 0:00,"Malcolm Bilson, fortepiano.",,
"1\$aLiszt, Franz,$d1811-1886.","10$aBlaise Bryski, piano :$bAn evening of Franz Liszt.","0\$aBlaise Bryski, piano.","00$tTwo concert etudes (1862-63).$tWaldesrauschen ;$tGnomenreigen --$tFrom Grandes etudes de Paganini : (1851) :$tTheme and variations, after Paganini's 24th caprice for solo violin --$tFive piano pieces.$tSehr langsam : (1863) ;$t(1866) ;$tSehr langsam :$t(1873) ;$tAndantino :$t(1876) ;$tSospiri! : (1879) --$tSonata in B minor (1852-53).","1\$aBryski, Blaise,$eperformer.","\\$oRecorded$d2009 September 18,$pBarnes Hall, Cornell University.",TRUE,Barnes,9/18/09 0:00,"Blaise Bryski, piano: An evening of Franz Liszt.",2009918_Bryski,
,"00$aMichael Clarkson, tenor, Graeme Bailey, piano.","0\$aMichael Clarkson, tenor ; Graeme Bailey, piano.","00$tFrom Songs of travel :$tThe vagabond ;$tLet beauty awake ;$tThe infinite shining heavens ;$tWhither must I wander? ;$tBright is the ring of words /$rRalph Vaughan Williams ---$tFrom Die Winterreise, D. 911 :$tGute Nacht ;$tDer Lindenbaum ;$tIrrlicht ;$tFr{uml}uhlingstraum ;$tDer Wegweiser /$rFranz Schubert --$tFrom The road goes ever on :$tThe road goes ever on ;$tUpon the hearth the fire is red ;$tIn western lands ;$tNam{acute}ari{uml}e ;$tI sit beside the fire ;$tBilbo's last song (at the grey havens) /$rDonald Swann --$tFrom Folk song arrangements :$tThe Salley gardens ;$tCome you not from Newcastle? ;$tO waly, waly ;$tThe ash grove /$rarr. Benjamin Britten.","1\$aClarkson, Michael,$eperformer.;1\$aBailey, Graeme,$eperformer.","\\$oRecorded$d2009 September 29,$pBarnes Hall, Cornell University.",TRUE,Barnes,9/29/09 0:00,"Michael Clarkson, tenor, Graeme Bailey, piano.",,
,"00$aEnsemble X, Steven Stucky, artistic director, Rachel Calloway, mezzo-soprano, Caroline Stinson, cello, Donald Crockett, guest conductor, Francesco Antonioni, guest conductor.","0\$aEnsemble X ; Steven Stucky, artistic director ; Rachel Calloway, mezzo-soprano ; Caroline Stinson, cello ; Donald Crockett, guest conductor ; Francesco Antonioni, guest conductor.","00$tVerge : (1997).$talmost too fast ;$talmost too slow ;$talmost too mechanical ;$talmost too dark ;$talmost too light ;$talmost too fractured ;$talmost too much ;$talmost too little ;$talmost too calm /$rSebastian Currier --$tFigment : (1994) /$rElliott Carter (Ms. Stinson) --$tThe cinnamon peeler : (1993) /$rDonald Crockett (Ms. Calloway, Mr. Crockett) --$tLe nom: upperline : (2005) /$rAndrew Waggoner (Ms. Stinson) --$tBallata (2008) /$rFrancesco Antonioni (Mr. Antonioni).","1\$aStucky, Steven,$eperformer.;1\$aCalloway, Rachel,$eperformer.;1\$aStinson, Caroline.$eperformer.;1\$aCrockett, Donald,$d1951-$eperformer.;1\$aAntonioni, Francesco,$d1971-$eperformer.","\\$oRecorded$d2009 September 26,$pBailey Hall, Cornell University.",FALSE,Bailey,10/3/09 0:00,"Ensemble X, Steven Stucky, artistic director, Rachel Calloway, mezzo-soprano, Caroline Stinson, cello, Donald Crockett, guest conductor, Francesco Antonioni, guest conductor.",2009926_Ensemble_X,
,"00$aCornell Chamber Orchestra, Cornell Symphony Orchestra.","0\$aCornell Chamber Orchestra ; Cornell Symphony Orchestra ; Blaise Bryski and Miri Yampolsky, piano ; Graeme Bailey, narrator ; Chris Younghoon Kim, conductor.","00$tThe carnival of animals.$tIntroduction and royal march of the lion ;$tHens and roosters ;$tWild asses;$tquick animals ;$tTortoises ;$tThe elephant ;$tthe (ir)rational animal by Peter Fahey ;$tKangaroos ;$tJungle monkey by Max Shuhan ;$tAquarium ;$tCharacters with long ears ;$tThe cuckoo in the depths of the woods ;$tAviary ;$tGila monster by Zachary Wadsworth ;$tPianists ;$tFossils ;$tUgly duckling by Takuma Itoh ;$tThe swan ;$tFinale /$rBlaise Bryski and Miri Yampolsky, piano ; Graeme Bailey, narrator (poems by Ogden Nash and composers) ; Chris Younghoon Kim, conductor --$tBeneath this stone /$rKristin Kuster --$tYoung person's guide to the orchestra, op. 43. Variations on a fugue on a theme of Purcell /$rBenjamin Britten ; Graeme Bailey, narrator (words by Eric Crozier) ; Chris Younghoon Kim, conductor.","1\$aBryski, Blaise,$eperformer.;1\$aYampolsky, Miri,$eperformer.;1\$aBailey, Graeme,$eperformer.;1\$aKim, Chris Younghoon,$eperfomer.","\\$oRecorded$d2009 October 3,$pBailey Hall, Cornell University.",FALSE,Bailey,10/3/09 0:00,"Cornell Chamber Orchestra, Cornell Symphony Orchestra.",,
,"00$aGuest artist, Shiau-uen Ding, piano and electronics.","0\$aShiau-uen Ding, piano and electronics.","00$tS{acute}erie blanche, for piano and electronics /$rPierre Jodlowski --$tS{acute}erie noire, for piano and electronics /$rJodlowski --$tUntitled 1994/96 /$rChristopher Bailey --$tOne man band 2 /$rMoritz Eggert --$tReflections, for pianos and tape /$rMilton Babbitt --$tBalladei, for piano and recorded electronics /$rBailey.","1\$aDing, Shiau-uen,$eperformer.","\\$oRecorded$d2009 October 7,$pBarnes Hall, Cornell University.",TRUE,Barnes,10/7/09 0:00,"Guest artist, Shiau-uen Ding, piano and electronics.",20091007_Stark_Ding,
"1\$aGodfrey, Daniel.","10$aGuest ensemble, Cassatt String Quartet:$bcelebrating Daniel S. Godfrey's sixtieth birthday season.","0\$aCassatt String Quartet (Muneko Otani and Jennifer Leshnower, violins ; Sarah Adams, viola ; Nicole Johnson, cello ; Adrienne Kim, piano).",00$tRomanza for string quartet and piano : (2001) --$tRicordanza-speranza for string quartet and piano : (2006).$tAdagio poco rubato ;$tCon furore ;$tAdagio poco rubato--con anima --$tString quartet no. 2 (1993).$tModerato ;$tAdagietto ;$tPresto.,"1\$aOtani, Muneko,$eperformer.;1\$aLeshnower, Jennifer,$eperformer.;1\$aAdams, Sarah Jane,$d1961-$eperformer.;1\$aJohnson, Nicole$c(Cellist),$eperformer.;1\$aKim, Adrienne,$eperformer.","\\$oRecorded$d2009 October 15,$pBarnes Hall, Cornell University.",TRUE,Barnes,10/15/09 0:00,"Guest ensemble, Cassatt String Quartet:$bcelebrating Daniel S. Godfrey's sixtieth birthday season.",20091015_Cassatt_String_Quartet,
,00$aCornell University Wind Ensemble,"0\$aCornell University Wind Ensemble ; Cornell Univesrity Wind Symphony ; Cynthia Johnston Turner, conductor ; Tim Feeney, percussion.",00$tCanzon primi toni /$rGiovanni Gabrieli --$tCathedrals /$rKathryn Salfelder --$tSerenade /$rDerek Bourgeois --$tColorado Springs /$rDana Wilson --$tHounds of spring /$rAlfred Reed --$tConcerto for percussion and wind orchestra /$rSteven Stucky --$tFirst suite in E-flat /$rGustav Holst --$tSymphonies of happy birthdays /$rZachary Wadsworth --$tHue and cry /$rStucky --$tHappy birthday variations /$rRyan Gallagher --$tSlava! /$rLeonard Bernstein.,"1\$aJohnston Turner, Cynthia,$econductor.;1\$aFeeney, Tim,$eperformer.","\\$oRecorded$d2009 October 18,$pBailey Hall, Cornell University.",FALSE,Bailey,10/18/09 0:00,Cornell University Wind Ensemble,,
,00$aAngela Early & Damien Mahiet.,"0\$aCornell Chamber Orchestra ; Cornell Symphony Orchestra ; Blaise Bryski and Miri Yampolsky, piano ; Graeme Bailey, narrator ; Chris Younghoon Kim, conductor.","00$tSonata for violin and piano in G major, opus 30, no. 3 : (1802).$tAllegro assai ;$tTempo di minuetto ma molto moderato e grazioso /$rLudwig van Beethoven --$tSonata for violin and piano in G minor : (1917).$tAllegro vivo ;$tInterm{grave}ede: fantasque et l{acute}eger ;$tFinale: tr{grave}es anim{acute}e /$rClaude Debussy --$tSonata for violin and piano in A major, no. 1, op. 13 : (1875).$tAllegro molto ;$tAndante ;$tAllegro vivo ;$tAllegro quasi presto /$rGabriel Faur{acute}e.","1\$aEarly, Angela,$eperformer.;1\$aMahiet, Damien,$eperformer.","\\$oRecorded$d2009 October 23,$pBarnes Hall, Cornell University.",TRUE,Barnes,10/23/09 0:00,Angela Early & Damien Mahiet.,20091023_Angela_Early_Damien_Mahiet,
,"00$aSteven Stucky, a 60th birthday celebration.",0\$aEnsemble X.,"00$tFrom Pi{grave}eces de clavecin, book II : $tLes baricades mist{acute}erieuses /$rFran{commab}cois Couperin ; arr. Thomas Ad{grave}es --$tSyd{uml}ameni laulu, op. 18, no. 6 /$rJean Sibelius --$tWhispers : (2002) /$rSteven Stucky (John Rowehl, conductor) --$tThree preludes (2005).$tLibellula meccanica ;$tChorale ;$tInvenzione a due voci /$rEsa-Pekka Salonen (Xak Bjerken, piano) --$tPartita (1984).$tAllegro giusto ;$tAd libitum ;$tLargo ;$tAd libitum;$tPresto /$rWitold Lutoslawski (Joseph Lin, violin ; Miri Yampolsky, piano) --$tAlbum leaves : (2002).$tContemplativo,$ttempo rubato ;$tMeccaninco ;$tSereno, luminoso ;$tPresto giocoso /$rStucky (Xak Bjerken, piano) --$tTwo poems of Konstantin Bal'mont.$tThe flower ;$tThe dove ;$tThree Japanese lyrics.$tAkahito ;$tMazatsumo ;$tTsaraiuki /$rIgor Stravinsky (Judith Kellock, soprano ; Chris Kim, conductor) --$tAd parnassum : (1998) /$rStucky (Jeffery Meyer, conductor).",,"\\$oRecorded$d2009 November 7,$pBarnes Hall, Cornell University.",TRUE,Barnes,11/7/09 0:00,"Steven Stucky, a 60th birthday celebration.",20091107_Steven_Stucky,
,00$aContrapunkt!$bnew music by undergraduate composers.,0\$aVarious perfomers.,"00$tFarewell and prayer /$rPallavi Basu (Pallavi Basu, piano) --$tThe blizzard /$rAndrew Bunyea (Vivian Li, piano) --$tThe place where music comes from (Carly Hodes) /$rCarly Hodes (Emilie Simoneau, mezzo-soprano ; Vivian Li, piano) --$tMonster (Sam Moghadam) /$rSam Moghadam (Sam Moghadam, voice and electric guitar) --$tTwo short piano pieces /$rMarwan Sledge (Marwan Sledge, piano) --$tA fury of notes for piano ;$tA fury of notes for clarinet and piano /$rLiza Sobel (Lenora Schneller, clarinet ; Bill Cowdery, piano) --$tSociety in chaos /$rRemanu Phillips (Remanu Phillips, piano) --$tSleepless /$rGreg Weisbrod (Greg Weisbrod, English horn) --$tThe geminate etudes /$rZachary Romeo (Zachary Romeo, piano) --$tAt the end of dawn /$rKadeem Gilbert (Ted Esposito, violin ; Tom Levine, cello ; Stephanie Quach, piano) --$tParticular floods, for chamber orchestra) /$rJulia Adolphe (Miriam Nussbaum, flute ; Greg Weisbrod, oboe ; Kimberly Banks, clarinet ; Sarah Furnish, bassoon ; Tyler Ogilvie, horn ; Eric Nathan, trumpet ; Steven Cooney, bass trombone ; Marco Schirripa, percussion ; Ada Jeon, piano ; Ellen Kogut and Maurice Chammah, violins ; Candy Amato, viola ; Tyler Borden, cello ; Joe Arcuri, bass ; Andrew Mattfeld, conductor).",,"\\$oRecorded$d2009 November 8,$pBarnes Hall, Cornell University.",TRUE,Barnes,11/8/09 0:00,Contrapunkt!$bnew music by undergraduate composers.,20091108_Contrapunkt,
,"00$aMathieu Langlois, baroque flute, Dorian Bandy, baroque violin and viola.","0\$aMathieu Langlois, baroque flute ; Dorian Bandy, baroque violin and viola.","00$tQuartet for flute, viola, and clavier in D major, Wq. 94.$tAllegretto ;$tSehr langsam und ausgehalten ;$tAllegro di molto /$rCarl Philipp Emanuel Bach (with David Yearsley, fortepiano) --$tSymphony quintetto, after symphony no. 104 in D major (""London, ""Salomon""), Hob. I: 104.$tAdagio--allegro ;$tAndante ;$tMinuetto--minuetto 2do [trio] ;$tAllegro spirituoso /$rJoseph Haydn ; arr. Johann Peter Salomon (with Angela Early, violin ; Rosie Newton, viola ; Nicholas Walker, violone ; Blaise Bryski, fortepiano).","1\$aLanglois, Mathieu,$eperformer.;1\$aBandy, Dorian Komanoff,$eperformer.","\\$oRecorded$d2009 November 9,$pBarnes Hall, Cornell University.",TRUE,Barnes,11/9/09 0:00,"Mathieu Langlois, baroque flute, Dorian Bandy, baroque violin and viola.",20091109_Langlois_Brandy,
,"00$aStefania Neonato, fortepiano :$bClementi grand piano in concert.","0\$aStefania Neonato, fortepiano.","00$tSonata in F-sharp minor, op. 25, no. 5.$tPiuttosto allegro con espressione ;$tLento e patetico ;$tPresto /$rMuzio Clementi --$tSonata in C major, op. 53 = (""Waldstein"").$tAllegro con brio ;$tIntroduzione: adagio molto ;$tRondo: allegretto moderato /$rLudwig van Beethoven.","1\$aNeonato, Stefania,$eperformer.","\\$oRecorded$d2009 November 11,$pBarnes Hall, Cornell University.",TRUE,Barnes,11/11/09 0:00,"Stefania Neonato, fortepiano: Clementi grand piano in concert.",20091111_Stefania_Neonato,
,00$aStudent chamber music recital.,0\$aVarious performers.,"00$tBallade no. 1 in G minor, op. 23 /$rFr{acute}ed{acute}eric Chopin (Annabel Suh, piano) --$tPiano trio in C minor, op. 1, no. 3.$tAllegro con brio ;$tAndante cantabile con variazioni ;$tMenuetto: quasi allegro ;$tFinale: prestissimo /$rLudwig van Beethoven (Annabel Suh, piano ; Yvonne Chang, violin ; Navin Sivakumar, cello) --$tFrom Fairy tales, for clarinet, viola and piano, op. 132 :$tLebhaft, nicht zu schnell ;$tLebhaft und sehr markirt ;$tRuhiges tempo, mit zartem Ausdruck /$rRobert Schumann (Jonathan Felbinger, clarinet ; Hannah de Kleer, viola ; Miri Yampolsky, piano) --$tTrio in A minor for clarinet, cello and piano, op. 114.$tAllegro ;$tAdagio ;$tAndantino grazioso ;$tAllegro /$tJohannes Brahms (Kenny Kang, clarinet ; Jonathan Auerbach, cello ; Robert Toha, piano).",,"\\$oRecorded$d2009 November 15,$pBarnes Hall, Cornell University.",TRUE,Barnes,11/15/09 0:00,Student chamber music recital.,20091115_Student_Chamber_Music_Recital,
,00$aCornell Chamber Singers.,"0\$aCornell Chamber Singers ; Holland Jancaitis, conductor ; William Cowdery, organ.","00$tCantata: Aus tiefer Not, schrei' ich zu dir, op. 23, no. 1.$tAus tiefer Not (chorale) ;$tAus tiefer Not (fugue)$r(Jonathan Ivers, tenor) ;$tBei dir gilt nichts$tOb bei uns ist der St{uml}unden viel$r(Beck Sopchak, alto ; Tyler Coatney, tenor ; Geoff Royall, bass) /$rFelix Mendelssohn --$tRequiem: Seele, vergi{C7} sie nicht /$rPeter Cornelius --$tLe reniement de St. Pierre /$rMarc-Antoine Charpentier (Jesus: Jonathan Ivers ; Historicus: Geoff Royall ; Petrus: Jonathan Kienzle ; Ostiaria: Jennifer Henion ; Ancilla: Liz Peters ; Malchi: Michael Clarkson) --$tWhich was the son of... /$rArvo P{uml}art.","1\$aJancaitis, Holland,$eperformer.;1\$aCowdery, William,$eperformer.","\\$oRecorded$d2009 November 15,$pFirst Unitarian Society, Ithaca, New York.",FALSE,Unitarian,11/15/09 0:00,Cornell Chamber Singers.,,
,00$aFaculty chamber music concert.,0\$aVarious performers.,"00$tSonata for cello and piano in C major, op. 102, no. 1.$tAndante--allegro vivace ;$tAdagio--tempo d'andante--allegro vivace /$rLudwig van Beethoven (John Haines-Eitzen, cello ; Miri Yampolsky, piano) --$tSongs without words, op. 62, nos. 1, 3, 5 /$rFelix Mendelssohn (Miri Yampolsky and Xak Bjerken, piano) --$tFrom Spanisches Liederbuch :$tSie blasen zum Abmarsch ;$tBedeckt mich mit Blumen ;$tHerr, was tr{uml}agt der Boden hier ;$tDie ihr schwebet um diese Palmen ;$tAlle gingen, Herz zer Ruh ;$tIn dem Schatten meiner Locken /$rHugo Wolf (Judith Kellock, soprano ; Blaise Bryski, piano) --$tPartita (1984).$tAllegro ;$tAd libitum ;$tLargo ;$tAd libitum ;$tPresto /$rWitold Lutoslawski (Joseph Lin, violin ; Miri Yampolsky, piano).",,"\\$oRecorded$d2009 November 16,$pBarnes Hall, Cornell University.",TRUE,Barnes,11/16/09 0:00,Faculty chamber music concert.,20091116_Faculty_Chamber_Music_Concert,
,"00$aCornell Contemporary Chamber Players, Israeli Chamber Project.","0\$aCornell Contemporary Chamber Players (Peter Fahey, Amit Gilutz, Takuma Itoh, Jesse Jones and Eric Nathan, directors) ; Israeli Chamber Project (Tibi Cziger, clarinet ; Sivan Magen, harp ; Gal Nyska, cello ; Assaff Weisman, piano ; Itamar Zorman, violin).","00$tArchipel, for clarinet, violin, and cello : (2009).$tfor Collin--meccanico ;$tfor Jenalie--molto lento ;$tfor Finley--con gioia /$rChristopher Stark --$tMusic for clarinet, violin, violoncello and harp (2009) /$rCharles Cacioppo --$t...In between, for bass clarinet, harp, piano, violin and cello : (2009) /$rTaylan Cihan --$tStorm's morrow: six pieces for harp after Haiku poetry : (2006) /$rAmit Gilutz --$tSnippet variations, for clarinet, violin, cello and piano : (2009) /$rJesse Jones.",,"\\$oRecorded$d2009 November 13,$pBarnes Hall, Cornell University.",TRUE,Barnes,11/19/09 0:00,"Cornell Contemporary Chamber Players, Israeli Chamber Project.",20091113_Cornell_Contemporary_Chamber_Players,
"1\$aHaydn, Joseph,$d1732-1809.","10$aHaydn Festival :$bchamber music and ""drum roll.""",0\$aVarious performers.,"00$tSonata in E minor, Hob. 34.$tPresto ;$tAdagio ;$tVivace molto (innocentemente)$r(Malcolm Bilson, fortepiano) --$tDer Augenblick ;$tDer Greis ;$tAlles hat seine Zeit ;$tAbendlied zu Gott$r(Judith Kellock, soprano ; Julia Adolphe, alto ; Thom Baker, tenor ; John Rowehl, bass ; Chi-Chen Wu, fortepiano) --$tString quartet in F minor, op. 55, no. 2.$tAndante o piu tosto allegretto ;$tAllegro ;$tMenuet: allegretto ;$tFinale: presto$r(Nicholas DiEugenio and Bee-Seon Keum, violins ; Joseph Lin, viola ; John Haines-Eitzen, cello) --$tPiano trio in A major, Hob. 18.$tAllegro moderato ;$tAndante ;$tAllegro$r(Malcolm Bilson, fortepiano ; Joseph Lin, violin ; John Haines-Eitzen, cello) --$tSymphony no. 103 in E-flat major : (""Drum roll"").$tAdagio--allegro con spirito ;$tAndante pi{grave}u tosto allegretto ;$tMenuetto ;$tFinale: allegro con spirito$r(Ithaca College Chamber Orchestra ; Jeff Meyer, conductor).",,"\\$oRecorded$d2009 November 20,$pBarnes Hall, Cornell University.",TRUE,Barnes,11/20/09 0:00,"Haydn Festival: chamber music and ""drum roll.""",20091120_Haydn_Festival_Day_1,
"1\$aHaydn, Joseph,$d1732-1809.",10$aHaydn Festival :$bCornell Chamber Orchestra.,"0\$aCornell Chamber Orchestra ; Chris Younghoon Kim, conductor ; Malcolm Bilson, fortepiano.","00$tOvertures (sinfonias) in D major, Hob. Ia:6, I:106.$tAdagio maestoso--presto ;$tAndante ;$tAllegro /$r(Damien Mahiet, conductor) --$tKeyboard concerto in G major, Hob. XVIII:4.$tAllegro ;$tAdagio ;$tFinale: rondo (presto) /$r(with Mr. Bilson) --$tSymphony no. 45 in F-sharp minor, Hob. I:45 : (""Farewell"").$tAllegro assai ;$tAdagio ;$tMenuet: allegretto ;$tFinale: presto--adagio.","1\$aKim, Chris Younghoon,$eperformer.;1\$aBilson, Malcolm,$eperformer.","\\$oRecorded$d2009 November 21,$pBarnes Hall, Cornell University.",TRUE,Barnes,11/21/09 0:00,Haydn Festival: Cornell Chamber Orchestra.,20091121_Haydn_Festival_Day_2,
"1\$aHaydn, Joseph,$d1732-1809.",10$aHaydn Festival :$bCornell Chorale,"0\$aCornell Chorale ; Holland Jancaitis, conductor ; Cornell Symphony Orchestra ; Chris Younghoon Kim, director.","00$tMissa in angustiis : (""Lord Nelson"" mass) : Hob. XXII:11.$tKyrie ;$tGloria ;$tCredo ;$tSanctus ;$tBenedictus ;$tAgunus Dei /$r(Melanie Scafide Russell, soprano ; Sylvia Aiko Rider, alto ; Steven Caldicott Wilson, tenor ; John Mark Chambers, baritone).","1\$aJancaitis, Holland,$econductor.;1\$aKim, Chris Younghoon.","\\$oRecorded$d2009 November 22,$pSage Chapel, Cornell University.",FALSE,Sage,11/22/09 0:00,Haydn Festival: Cornell Chorale,,
,"00$aCornell University Wind Symphony, Cornell University Percussion Ensemble.","0\$aCornell University Wind Symphony ; Cynthia Johnston Turner, conductor ; Cornell University Percussion Ensemble ; Timothy Feeney, director.","00$tFrom Amores: III /$rJohn Cage --$tSymphonic songs for band /$rRobert Russell Bennett --$tFrom Amores : II /$rCage --$tSasha takes a train /$rKim Portnoy --$tFrom Symphony no. 5 : II ; III /$rLou Harrison --$tConcertino for four percussion and wind ensemble /$rDavid Gillingham (Thomas Weber, Chase Rakowski, Ian Chen, and Ian Goldin, percussion).","1\$aJohnston Turner, Cynthia,$eperformer.;1\$aFeeney, Tim.","\\$oRecorded$d2009 November 22,$pBailey Hall, Cornell University.",FALSE,Bailey,11/22/09 0:00,"Cornell University Wind Symphony, Cornell University Percussion Ensemble.",,
,00$aStudent chamber music recital.,0\$aVarious performers.,"00$tFrom Last poems of Wallace Stevens : (1972) :$tNot ideas about the thing but the thing itself ;$tA child asleep in its own life ;$tThe dove in spring ; Interlude ;$tOf mere being ;$tA clear day and no memories /$rNed Rorem (Sarah Robinson, soprano ; Sarah Smith, cello ; Stephen Bowden, piano) --$tSonata no. 1 in F minor for violin and piano, op. 80.$tAndante assai ;$tAllegro brusco ;$tAndante ;$tAllegrissimo--andante assai, come prima /$rSergei Prokofiev (Bee-Seon Keum, violin ; Daniel Anastasio, piano).",,"\\$oRecorded$d2009 December 1,$pBarnes Hall, Cornell University.",TRUE,Barnes,12/1/09 0:00,Student chamber music recital.,2009121_Student_Chamber_Music_Recital,
,00$aStudio 342 :$bvoice students of Judith Kellock.,"0\$aVarious vocalists ; Blaise Bryski, coach ; Chi-Chen Wu and Holland Jancaitis, pianists.","00$tFrom Cosi fan tutte :$tDonne mie, le fate a tanti /$rWolfgang Amadeus Mozart (Guglielmo: John Chambers) --$tFrom Norge--fem digte af John Paulsen, op. 58 :$tTuristen /$rEdvard Grieg ; From Spanisches Liederbuch :$tTief im Herzen trag' ich Pein /$rHugo Wolf (Emilie simoneau, mezzo-soprano) --$tFrom Die Fledermaus :$tMein Herr Marquis = (""The laughing song"") /$rJohann Strauss (Adele: Sarah Ajaeb) --$tThe sky above the roof (Paul Verlaine) /$rRalph Vaughan Williams --$tFrom The pilgrim's progress (Psalms, Isaiah) :$tWatchful's song (Nocturne) /$rVaughan Williams (Daniel Schug, tenor ; Ryan Caira, piano) --$tFrom Gianni Schicchi :$tOh mio babbino caro /$rGiacomo Puccini (Lauretta: Rosa Von Gleichen) --$tFrom Lakm{acute}e :$tSous le d{circ}ome {acute}epais = (""The flower duet"") /$rL{acute}eo Delibes  (Lakm{acute}e: Rosa Von Gleichen ; Malika: Julia Adolphe) --$tOn the beach at Fontana (James Joyce) /$rRoger Sessions (Julia Adolphe, soprano) --$tFrom The aids quilt songbook :$tI never knew (Gordon) /$rRicky Ian Gordon (John Chambers, baritone) --$tFrom Le nozze di Figaro :$tGiunse alfin il momento ;$tDeh vieni non tardar /$rWolfgang Amadeus Mozart (Susanna: Kristina Brooks) --$t Piet{grave}a, signore /$rAnonymous (attrib. Stradella) (Christos Nicholoudis, tenor) --$tFrom Twelve poems of Emily Dickinson :$tGoing to heaven /$rAaron Copland ;$tFrom The medium :$tMonica's waltz /$rGian Carlo Menotti (Liza Sobel, soprano) --$tIf music be the food of love /$rHenry Purcell (Erin Goers, soprano) --$tVittoria, vittoria! /$rGiacomo Carissimi ;$tFrom South Pacific (Richard Rogers) :$tYounger than springtime /$rOscar Hammerstein (Aaron Sprecher, bass-baritone) --$tFrom Die Entf{uml}uhrung aus dem Serail :$tDurch Z{uml}artlichkeit und Schmeicheln ;$tWelche Wonne, welche Lust /$rMozart (Blondchen: Sarah Robinson) --$tFrom Samson et Dalila :$tMon coeur s'ouvre {grave}a ta voix /$rCamille Saint-Sa{uml}ens (Dalila: Emilie Simoneau).","1\$aKellock, Judith.;1\$aBryski, Blaise,$eperformer.;1\$aWu, Chi-Chen,$eperformer.;1\$aJancaitis, Holland,$eperformer.","\\$oRecorded$d2009 December 2,$pBarnes Hall, Cornell University.",TRUE,Barnes,12/2/09 0:00,Studio 342: voice students of Judith Kellock.,2009122_Voice_Students_of_Judith_Kellock,
,00$aStudio recital :$bpiano students of Xak Bjerken.,0\$aVarious performers.,"00$tBallade in G minor, op. 23 /$rFr{acute}ed{acute}eric Chopin (Annabell Suh) --$tFrom English suite no. 6 in D minor, BWV 811 :$tPrelude /$rJohann Sebastian Bach (Robert Toha) --$tSonata in F minor, op. 1 /$rSergei Prokofiev (Albert Zhang) --$tIntermezzo in A-flat major /$rFrancis Poulenc (Irene Shao) --$tFrom Moments musicaux, op. 16 :$tNo. 3 in B minor ;$tNo. 4 in E minor /$rSergei Rachmaninoff (Stephen Bowden) --$tFrom Sonata for piano (1952) :$tAllegro marcato /$rAlberto Ginastera (Jesse Jones) --$tConcerto no. 1 in E-flat major, S. 124.$tAllegro maestoso ;$tQuasi adagio--allegretto vivace ;$tAllegro marziale animato /$rFranz Liszt (Jennifer Huang ; Jesse Jones, orchestra) --$tFrom Sonata in C minor, Hob. XVI: 20 :$tAllegro moderato /$rJoseph Haydn (Daniel Anastasio) --$tNocturne in C minor, op. 48 /$rChopin (Damien Mahiet) --$tFrom Fantasiest{uml}ucke, op. 12 :$rDes Abends ;$tIn der Nacht ;$tWarum?$tEnde vom Lied /$rRobert Schumann (Hu Fu) --$tBallade in A-flat major, op. 47 /$rChopin (Sharon Lau) --$tFrom Sonata in B-flat minor, op. 36 /$rRachmaninoff (Yinou Tang).",,"\\$oRecorded$d2009 December 3,$pBarnes Hall, Cornell University.",TRUE,Barnes,12/3/09 0:00,Studio recital: piano students of Xak Bjerken.,2009123_Studio_Recital_Piano_Students_of_Xak_Bjerken,
,00$aStudio recital :$bviolin students of Joseph Lin.,"0\$aVarious performers ; Chi-Chen Wu, piano.","00$tButterfly lovers concerto (Liang Shan Bo Yu Zhu Ying Tai) /$rHe Zhan Hao, Chen Gang (Elaine Higashi, with Graeme Bailey) --$tFrom Concerto in E minor, op. 64 :$tAllegro molto appassionato /$rFelix Mendelssohn (Marit Imsdahl, with Solveig Imsdahl) --$tRomance in F major.$tAllegro /$rLudwig van Beethoven (Katie Bobroske) --$tTzigane /$rMaurice Ravel (Will Moseson) --$tFrom Symphonie Espagnole in D minor, op. 21 :$tAllegro non troppo /$rEdouard Lalo (Carol Tsang) --$tZigeunerweisen /$rPablo de Sarasate (Aaron Wexler) --$tFrom Concerto in D minor, op. 35 :$tAllegro moderato /$rPiotr Ilyich Tchaikovsky (Thomas Collum).","1\$aWu, Chi-Chen,$eperformer.","\\$oRecorded$d2009 December 5,$pBarnes Hall, Cornell University.",TRUE,Barnes,12/5/09 0:00,Studio recital: violin students of Joseph Lin.,,
